Pizza Press And Method Of Making A Pizza,US2011217434 (A1),08/09/2011,BRADY SHANE P [US],,A47J37/01; A21D8/02; A21D13/00,A47J37/01; A21D8/02; A21D13/00,US201113041493,20110307,US201113041493 20110307; US20100310800P 20100305,US2009302042 (A1); US5074777 (A); US6557260 (B1),,,,,,,,,,,,,APPARATUS FOR CONVERTING KETTLE OR KAMADO STYLE COOKING GRILLS FOR COOKING PIZZA,US2011214662 (A1),08/09/2011,CONTARINO JR ALFRED F [US],,A47J37/07,A47J37/07,US20100963140,20101208,US20100963140 20101208; US20100311556P 20100308,US4467709 (A); US3299800 (A); US2842116 (A); US4437396 (A); US2010124596 (A1); US3657996 (A); US5768977 (A); US4962696 (A); US5850780 (A),,,,,,,,,,,,,"A CONTAINER FOR FOOD, IN PARTICULAR FOR PIZZA",WO2012011064 (A1),26/01/2012,CICCONE ALESSANDRO [IT],CICCONE ALESSANDRO [IT];  CICCONE DANIELA RITA [IT];  CICCONE GABRIELLA [IT],B65D5/42; B65D85/36,B65D5/4295; B65D5/48002; B65D2585/366,WO2011IB53242,20110720,IT2010TO00132U 20100723,,,,,,,,,,,CH316996 (A); US6196448 (B1); EP1298073 (A1),,,A springhead about mini diet pizza,KR20100008118 (U),13/08/2010,,,A21D13/00; A21D2/36; A21D13/04,,KR20100007586U,20100720,KR20100007586U 20100720,,,,,,,,,,,,,,AN OVEN FOR CONE SHAPED PIZZA,KR20100006895 (U),08/07/2010,,,F24C7/04; A21B2/00; F24C7/00,,KR20080017244U,20081229,KR20080017244U 20081229,,,,,,,,,,,,,,Pizza Box,KR20100005614 (U),04/06/2010,,,B65D85/36; B65D5/36,,KR20080015598U,20081125,KR20080015598U 20081125,,,,,,,,,,,,,,A METHOD FOR FANUFACTURING OF RICE CAKE PIZZA,KR20110074043 (A); KR101135192 (B1),30/06/2011,SONG IN SOON [KR],SONG IN SOON [KR],A21D13/00; A21D6/00; A23L1/10,,KR20090130889,20091224,KR20090130889 20091224,,,KR20090121780 (A),,,,,,,,,,,MANUFACTURE METHOD FOR PIZZA DOUGH,KR20110073859 (A),30/06/2011,LEE GYU CHAN [KR],LEE GYU CHAN [KR],A23L1/20,,KR20090130632,20091224,KR20090130632 20091224,,,,,,,,,,,,,,PIZZA INCLUDING PIZZA SOURCE,KR20110068617 (A),22/06/2011,AHN MYUNG HWAN [KR];  KWON HYUN JIN [KR],AHN MYUNG HWAN [KR];  KWON HYUN JIN [KR],A21D13/00,,KR20090125661,20091216,KR20090125661 20091216,,,,,,,,,,,,,,VENDING MACHINE FOR INSTANT PIZZA,KR20110066374 (A); KR101090647 (B1),17/06/2011,HWANG WOON JU [KR];  IM KYUNG JA [KR],HWANG WOON JU [KR];  IM KYUNG JA [KR],G07F11/00,,KR20090122997,20091211,KR20090122997 20091211,,,,,,,,,,,,,,THROWAWAY FINGER CAP,KR20110065230 (A),15/06/2011,LEE SUNG MIN [KR];  PARK SU HEE [KR],LEE SUNG MIN [KR],A47G21/10,,KR20090122114,20091209,KR20090122114 20091209,,,,,,,,,,,,,,METHOD OF PREPARING PIZZA-NOODLES WITH BLACKISH BEANSAUCE,KR20110063124 (A),10/06/2011,KIM HAK YOL [KR],KIM HAK YOL [KR],A21D13/00,,KR20090120069,20091204,KR20090120069 20091204,,,,,,,,,,,,,,Structure of integrated hand-held pizza box,TWM349898 (U),01/02/2009,JI SHIN-HUNG [TW],DIN YI PRINTING CO LTD [TW],B65D5/32,,TW20080213749U,20080801,TW20080213749U 20080801,,,,,,,,,,,,,,METHOD AND PORTABLE APPARATUS OF DISCRIMINATING MOZZARELLA CHEESE,KR20110051853 (A),18/05/2011,HAM JUN SANG [KR];  JEONG SEOK GEUN [KR];  CHAE HYUN SEOK [KR];  JANG AE RA [KR];  HAN GI SUNG [KR];  KIM DONG HUN [KR];  LEE SEUNG GYU [KR],REPUBLIC KOREA MAN RURAL DEV [KR],G01N33/04; G01N21/359,,KR20090108641,20091111,KR20090108641 20091111,,,,,,,,,,,,,,"Foodstuff Holder, Blank for Same and Serving Method",US2011195164 (A1),11/08/2011,DRURY EVAN [CA],,B65D5/42; B65D5/20; B65D77/00,A47G21/001; B65D2585/366,US201113019360,20110202,US201113019360 20110202; US20100302266P 20100208,US1869609 (A); US2011383 (A); US6299918 (B1); US2004035863 (A1); EP1378459 (A2),,,,,,,,,,,,,TOOL WITH ERGONOMIC HANDLE AND REPLACEABLE CUTTER HEAD,CA2746710 (A1),08/07/2010,KEMPKER JEFFREY ALLEN [US];  CRAIN ORVILLE V [US];  JACOBS MATTHEW JON [US],KLEVER KUTTER L L C [US],B25G1/10; B25B33/00; B25F1/00; B25F1/02; B25G1/00; B25G3/00,B25F1/02; B25G1/102; B25G3/18; B26B5/00; B26B25/005; B26B27/005,CA20092746710,20091217,US20080138262P 20081217; US20090620999 20091118; WO2009US68389 20091217,,,,,,,,,,,,,,Pizza cutter,USD642879 (S1),09/08/2011,CHAN ERIC PING PANG [US],TRUDEAU CORP 1889 INC [CA],,,US201129383511F,20110119,US201129383511F 20110119,,,,,,,,,,,,,,Pizza box with storage compartments,US2011186621 (A1),04/08/2011,PARKER ANDRE [US],,B65D25/04,B65D25/04,US20100652738,20100203,US20100652738 20100203,US2004200891 (A1); US2003029769 (A1); US6823988 (B2); US6527168 (B1); US6401927 (B1); US6237845 (B1); US6173833 (B1); US5476214 (A); US5379886 (A); US5110038 (A); US5077050 (A); US2924372 (A); US2808191 (A); US1458679 (A); US1446014 (A),,,,,,,,,,,,,Modular pizza cart,US2011185919 (A1),04/08/2011,YGLESIAS GUILLERMO JULIO [US],,A47J37/00,A47J37/00,US20100658206,20100203,US20100658206 20100203,US3289664 (A); US4791861 (A); US5033366 (A); US6431628 (B1); US6598514 (B2); US2001002674 (A1); US2010034935 (A1); US2010107899 (A1),,,,,,,,,,,,,"Partial oiling of dough piece such as pizza base, comprises applying an oil film on a carrier, transferring the dough piece on the carrier, and transferring the dough piece from the carrier to a support such as conveyor belt for baking",DE102010001546 (A1),04/08/2011,SPAMER HELMUT [DE],FRITSCH GMBH [DE],A21C9/00,A21C9/04,DE20101001546,20100203,DE20101001546 20100203,DE19640378 (C2); DE3826035 (C2); DE69719426T (T2),,,,,,,,,,,,,Combination delivery box and board game,US2011169220 (A1),14/07/2011,NOUHAN JR HARRY P [US],,A63F3/00,A63F3/00895; A63F2003/00287; A63F2003/00514; A63F2003/00946; A63F2003/00962; A63F2003/00968; A63F2009/0012,US20100655801,20100108,US20100655801 20100108,,,,,,,,,,,,,,Pizza bag,USD641254 (S1),12/07/2011,SELA DAVID [US],LFG TRADE LLC [US],,,US20100379206F,20101116,US20100379206F 20101116,,,,,,,,,,,,,,Tool of eating pizza,KR200449214 (Y1),24/06/2010,,,A47G21/10; A47J43/28,,KR20090009145U,20090714,KR20090009145U 20090714,,,,,,,,,,,,,,Dough for pizza and method for the production thereof,SK5200 (Y1); SK1122008 (U1),07/01/2009,SUPIK RASTISLAV [SK],SUPIK RASTISLAV [SK],A21D2/00; A21D8/02; A21D13/00; A23L3/01,,SK20080000112U,20081007,SK20080000112U 20081007,,,,,,,,,,,,,,"Anti-scald, anti-bottom-coking and anti-loosing household electric heating pizza pan",CN201888717 (U),06/07/2011,SHAOJIANG WANG;  WEI ZHANG,NINGBO FENGYA ELECTRICAL APPLIANCES CO LTD,A47J37/06,,CN20102627900U,20101117,CN20102627900U 20101117,,,,,,,,,,,,,,2-Piece Type Packing Box for Pizza,KR20100011298 (U),19/11/2010,,,B65D85/36; B65D5/20; B65D5/38; B65D5/62,,KR20090005685U,20090511,KR20090005685U 20090511,,,,,,,,,,,,,,CONE PIZZA OVEN,KR20100003400 (U); KR200454243 (Y1),29/03/2010,,,F24C15/08; F24C7/04; F24C15/00,,KR20080012641U,20080919,KR20080012641U 20080919,KR20050063969 (A),,KR100789740B (B1); KR20050063944 (A),,,,,,,,,,,A Comfortable Pizza Prop,KR20100002469 (U),09/03/2010,,,B65D85/36,,KR20080011475U,20080827,KR20080011475U 20080827,,,,,,,,,,,,,,Pizza turner,CN201879535 (U),29/06/2011,DONGLUN YIN,YONGKANG MINGXIN IMP AND EXP CO LTD,A47J43/28,,CN20102675772U,20101223,CN20102675772U 20101223,,,,,,,,,,,,,,Pizza ovens,USD640499 (S1),28/06/2011,KING COURTNEY A [US];  ALLEN DAVID [US],BIRD BRAIN INC [US],,,US20100360913F,20100503,US20100360913F 20100503,,,,,,,,,,,,,,Automated hot food vending machine for pre-packaged food articles,US2011139809 (A1),16/06/2011,SAWH O'NEIL K [US];  HOYT MARK [US],,G07F9/10,G07F9/105; G07F11/54; G07F17/0078; H05B6/808,US20090321375,20090116,US20090321375 20090116; US20080022010P 20080118,US2005005618 (A1); US2005156027 (A1); US4757915 (A); US2007170195 (A1); US3534676 (A); US4783582 (A); US5503300 (A); US3620341 (A); US2007170179 (A1); US5487488 (A),,,,,,,,,,,,,Convertible Pizza Box,US2011138750 (A1),16/06/2011,WALSH WILLIAM R [US],,B65D5/54; B65B9/00,B65D5/22; B65D5/54; B65D5/5475; B65D5/6664; B65D2585/366,US20100849242,20100803,US20100849242 20100803; US20060527986 20060926,US1933643 (A); US2444987 (A); US2789751 (A); US2894673 (A); US4484683 (A); US5071062 (A); US5110038 (A); US5203493 (A); US5209392 (A); US5358174 (A); US5713509 (A); US6375066 (B1); US6386440 (B1); US6905065 (B2); US7051919 (B1),,,,,,,,,,,,,Pizza cutter,USD639619 (S1),14/06/2011,WAEGE LANCE D [US],,,,US20100377996F,20101028,US20100377996F 20101028,,,,,,,,,,,,,,RICE FLOUR PREMIX,JP2011083252 (A),28/04/2011,UTSUMI KENJI;  SAITO RIE;  ISHIKAWA MINEKO;  UMEMOTO YURIE;  ITO SEIICHIRO;  HIRAMOTO FUKUKO,MARUNI SHOKUHIN KK;  TOME RICE SERVICE KK,A23L1/16; A21D10/00; A21D13/04,,JP20090239975,20091019,JP20090239975 20091019,,,,,,,,,,,,,,Oven with low-level outlet,GB2489421 (B); GB2489421 (A),03/10/2012,CHADWICK DANIEL SEBASTIAN [GB];  ADAMS GUY DE WARRENNE BRUCE [GB],CHADWICK DANIEL SEBASTIAN [GB];  ADAMS GUY DE WARRENNE BRUCE [GB],A21B5/00; F24C15/10,F24B1/003; A21B5/00; F24C15/10,GB20110005053,20110325,GB20110005053 20110325,WO2011027096 (A1); US2009064985 (A1); WO2011027096 (A1); US2009064985 (A1),,,,,,,,,,,,,High Protein Slimming Pizza,EP2417855 (A1),15/02/2012,GALGANI RICCARDO [IT];  POLZELLA ANTONIO [IT],POLZELLA ANTONIO [IT],A21D13/00; A23L1/29,A21D13/007; A21D2/263; A21D2/266; A21D2/36; A21D2/366; A21D13/04; A21D13/062; A21D13/064; A23L1/293; A23L1/305; A23V2002/00; A23V2002/00; A23V2200/332,EP20110425056,20110308,IT2010LI00007 20100812,JP2003259796 (A); SU1831286 (A3),XP002638820; XP002638724; XP002638725; XP002638726; XP002638727,,,,,,,,,,,,SPROUT AND BLUEBERRY PIZZA,KR20110026067 (A),15/03/2011,JOUNG YOUNG SUN [KR],JOUNG YOUNG SUN [KR],A21D13/00; A21D2/36,,KR20090083800,20090907,KR20090083800 20090907,,,,,,,,,,,,,,SPROUT AND ONION PIZZA,KR20110023943 (A),09/03/2011,JOUNG YOUNG SUN [KR],JOUNG YOUNG SUN [KR],A21D13/00,,KR20090081743,20090901,KR20090081743 20090901,,,,,,,,,,,,,,PIZZA USING CRAB AND ITS MANUFACTURING METHOD,KR20110023010 (A); KR101183121 (B1),08/03/2011,PARK JU JIN [KR],PARK JU JIN [KR],A21D13/00; A21D2/34,,KR20090080579,20090828,KR20090080579 20090828,,,,,,,,,,,,,,"METHOD AND APPARATUS FOR FORMING DOUGH, AND A DOUGH FORM THEREFROM",US2011100232 (A1),05/05/2011,AONUMA SABURO [JP],SATACO CO LTD [JP],A21D6/00; A21C11/00,A21C11/006,US20110987446,20110110,JP20050089730 20050225; US20050157172 20050621; US20110987446 20110110; JP20040212313 20040622,US3669605 (A); US4373889 (A); US5470513 (A); US5469779 (A); US6332768 (B1),,,,,,,,,,,,,Hand held rotary cutting devices,US2011099818 (A1); US8555513 (B2),05/05/2011,MORELAND JESSICA A [US];  HAWKER CHRISTOPHER L [US],"MORELAND JESSICA A, ; HAWKER CHRISTOPHER L, ; TRIDENT DESIGN, LLC",B26D1/143,B26B25/005,US20100660875,20100305,US20100660875 20100305; US20090280344P 20091102,US2004231475 (A1); US5299355 (A); US7188424 (B2); US3590483 (A); US2010037787 (A1); USD375662S (S); US5220729 (A); US6643936 (B2); US2255930 (A); USD509710S (S1); US3644994 (A); US2007028463 (A1); US7134209 (B1); USD642879S (S1); US6438850 (B2); USD661555S (S1); US6938348 (B2); US2644230 (A); USD494823S (S1); US2005028388 (A1); US7823292 (B1); US2010319513 (A1); BE1013992 (A6); US2255930 (A); US2644230 (A); US3590483 (A); US3644994 (A); US5220729 (A); US5299355 (A); USD375662S (S); US6438850 (B2); US6643936 (B2); USD494823S (S1); USD509710S (S1); US6938348 (B2); US7134209 (B1); US7188424 (B2); US7823292 (B1); USD642879S (S1); USD661555S (S1); US2004231475 (A1); US2005028388 (A1); US2007028463 (A1); US2010037787 (A1); US2010319513 (A1); BE1013992 (A6),,,,,,,,US54223 (A); US209065 (A); US252268 (A); US609213 (A); US733511 (A); US775434 (A); US1983778 (A); US2490255 (A); USD159723S (S); US2526154 (A); US3621894 (A); US4020550 (A); US4432137 (A); US4738028 (A); US5101564 (A); USD330665S (S); USD352426S (S); US5369886 (A); USD355815S (S); US5428898 (A); US5504998 (A); US5711077 (A); USD397001S (S); US6094824 (A); USD460338S (S1); USD519334S (S1); US7363710 (B2); USD594292S (S1); USD639619S (S1); US8011103 (B2); USD652271S (S1); US2004049924 (A1),,,,,"SERVING-DISH SYSTEM COMPRISING A BUILT-IN DOME-COVER, HAVING A THERMAL CORE, FOR FOOD INSIDE SAID SYSTEM",WO2011121441 (A2); WO2011121441 (A3),06/10/2011,LEPINAY MARC [FR],LEPINAY MARC [FR],A47G19/26; A47G23/02; A47G23/04; A47J39/02,A47J39/02; A47G19/265; A47G23/04,WO2011IB00737,20110504,WO2011IB00737 20110504,,,,,,,,,,,US1591866 (A); US5345784 (A); NL1019227C (C1),,,U-shaped pizza tray,CN201798403 (U),20/04/2011,BINGLONG SU,QUANZHOU YUANDONG ENVIRONMENTAL TECHNOLOGY CO LTD,A47G19/02,,CN20102528884U,20100915,CN20102528884U 20100915,,,,,,,,,,,,,,Pizza vending machine,CN201788547 (U),06/04/2011,XIJUN DU,SHAANXI YANTA FENGTOU PIPE INDUSTRY CO LTD,G07F11/00,,CN20102157600U,20100407,CN20102157600U 20100407,,,,,,,,,,,,,,CIRCULAR PIZZA PACKAGING BOX,RS20080483 (A),07/05/2010,PETKOV DRAGAN [RS],PETKOV DRAGAN [RS],B65D5/36,,RS2008P000483,20081016,RS2008P000483 20081016,,,,,,,,,,,,,,Multifunctional oven,CN201779708 (U),30/03/2011,JINZHONG CHEN,JINZHONG CHEN,F24C1/00,,CN20102296066U,20100818,CN20102296066U 20100818,,,,,,,,,,,,,,Pizza cutter,USD634990 (S1),29/03/2011,COHEN PAUL K [US];  SHENKAL YUVAL [US],NATIONWIDE PROMOTIONS LLC [US],,,US20100365397F,20100708,US20100365397F 20100708,,,,,,,,,,,,,,Electric heating cooker,CN201759393 (U),16/03/2011,AN HU YUE,HU YUEAN,A47J37/06; A47J36/06,,CN20102233281U,20100621,CN20102233281U 20100621,,,,,,,,,,,,,,Take-out bag for pizza,CN201759001 (U),16/03/2011,XIANGJIE SUN,CHIUKO BUSINESS DEV SHANGHAI CO LTD,A45F3/00; A45C11/00,,CN20102513726U,20100830,CN20102513726U 20100830,,,,,,,,,,,,,,AUTOMATED PIZZA PREPARATION AND VENDING SYSTEM,US2011059209 (A1),10/03/2011,KHATCHADOURIAN PUZANT [US],K & G ENTPR LLC [US],B65B25/06; A21B1/48; A23P1/00; A47J43/00,A21C11/006; A21D13/007,US20100685506,20100111,US20100685506 20100111; US20090472844 20090527; US20080246006 20081006; US20080035827 20080222; US20070891218P 20070222,GB2123394 (A); US6011249 (A),,,,,,,,,,,,,Novel chopping board,CN201755155 (U),09/03/2011,FEI ZHANG,FEI ZHANG,A47J47/00,,CN20102210894U,20100601,CN20102210894U 20100601,,,,,,,,,,,,,,DOUGH PREMIX COMPOSITION CONTAINING MULBERRY LEAVES AND ITS MANUFACTURING METHOD,KR101067852 (B1); KR20110000866 (A),06/01/2011,MYUNG JUNG GIL [KR],MYUNG JUNG GIL [KR],A21D2/36,,KR20090058172,20090629,KR20090058172 20090629,KR100556269B (B1); KR20000006635 (A); KR20010027408 (A); KR20070028490 (A),,,,,,,,,,,,,CUTTING AND SHARPENING DEVICE AND METHOD,WO2011100144 (A3); WO2011100144 (A2),18/08/2011,HOLCOMB DAVID A [US];  KRUS MATTHEW [US],CHEF N CORP [US];  HOLCOMB DAVID A [US];  KRUS MATTHEW [US],B26B25/00,B26B25/005,WO2011US23432,20110202,US20100303434P 20100211,,,,,,,,,,,US5311664 (A); US1418053 (A); WO2006093482 (A1); US3562907 (A); US1666643 (A); US3783513 (A); US6502313 (B1); US2005188545 (A1); EP2098340 (A1),,,Pizza cutter,CN201736253 (U),09/02/2011,DAQIAN SITU,DAQIAN SITU,B26B25/00; B26B29/02,,CN20102166774U,20100415,CN20102166774U 20100415,,,,,,,,,,,,,,Pizza chopping block,CN201727380 (U),02/02/2011,DAQIAN SITU,DAQIAN SITU,A47J37/01,,CN20102166775U,20100415,CN20102166775U 20100415,,,,,,,,,,,,,,PIZZA DOUGH CONTAINING MULBERRY AND RICE AND ITS MANUFACTURING METHOD,KR101002770 (B1),21/12/2010,MYUNG JUNG GIL [KR],MYUNG JUNG GIL [KR],A21D13/00,,KR20100043450,20100510,KR20100043450 20100510,,,,,,,,,,,,,,NATURAL PULP BOX FOR PIZZA PACKING AND MANUFACTURING METHOD THEREOF,KR100999464 (B1),09/12/2010,CHO KEE POONG [KR],KUKMINPNTECH [KR],B65D85/36; B31B5/60; B65D5/28; D21H11/00,,KR20100032944,20100409,KR20100032944 20100409,,,,,,,,,,,,,,COMPOSITION FOR ANTICOAGULATION COMPRISING FUCO-OLIGOSACCHARIDES,KR20100138438 (A),31/12/2010,CHUNG MI KYUNG [KR];  PARK JOO WOONG [KR];  SUH HYUN HYO [KR];  PARK YOUNG IL [KR];  KIM WOO JUNG [KR],HANRIB LIFETECH INC [KR],A61K31/737; A23L1/30; A61P7/02,,KR20090056980,20090625,KR20090056980 20090625,,,,,,,,,,,,,,THE PIZZA BOX THAT LID COMES TO GET FOLDED WITH AUTOMATIC,KR101109341 (B1); KR20100132388 (A),17/12/2010,JEONG BYUNG TAE [KR],JEONG BYUNG TAE [KR],B65D85/36; B65D5/20; B65D5/24; B65D5/36,,KR20090051185,20090609,KR20090051185 20090609,KR20030020087 (A); JP2008155960 (A); KR20040031897 (A),,,,,,,,,,,,,A MANUFACTURING PROCESS OF REFRIGERATED-PIZZA,KR20100131187 (A),15/12/2010,I JU NAM [KR],I JU NAM [KR],A21D13/00; A23L3/36; B65D85/30,,KR20090049957,20090605,KR20090049957 20090605,,,,,,,,,,,,,,PIZZA OVEN,KR20100126926 (A); KR101124520 (B1),03/12/2010,HAN HYUN [KR];  KIM KI NAM [KR];  KIM JUENG JAE [KR];  HONG DOO HAN [KR],K M TECH CO LTD [KR],A21B1/40; A21B1/26,,KR20090045359,20090525,KR20090045359 20090525,KR20020061099 (A); KR20060062230 (A); KR20070053566 (A); KR20050062794 (A),,,,,,,,,,,,,"Corrugated cardboard packaging for foodstuff, especially pizza",PL118260 (U1),06/12/2010,WISNIEWSKA STEFANIA [PL],WISNIEWSKA STEFANIA WYTWORNIA OPAKOWAN KARTONOWYCH [PL],B65D5/54; B65D85/36,,PL20090118260U,20090601,PL20090118260U 20090601,,,,,,,,,,,,,,FRIED SNACK FOOD PRODUCT,US2011014320 (A1),20/01/2011,ZABLE MARK [US],,A21D13/00; A21D8/04,A21D13/0022; A21D13/0067; A23L1/1645; A23L2/395; A23L3/362; C12C7/28,US20100880755,20100913,US20100880755 20100913; US20100367224P 20100723,US2004161502 (A1); US4741908 (A); US4693899 (A),,,,,,,,,,,,,Roasting machine,CN201710175 (U),19/01/2011,ZHENXIU ZHANG,MINGHAN ENTPR CO LTD,A47J37/06,,CN20102166716U,20100421,CN20102166716U 20100421,,,,,,,,,,,,,,KOREA PIZZA,KR20100123572 (A),24/11/2010,PARK JAE JIN [KR],PARK JAE JIN [KR],A23P1/08; A23L1/10,,KR20090043306,20090515,KR20090043306 20090515,,,,,,,,,,,,,,DELIVERY PACKING BOX HAVING A CUTTING KNIFE FOR PIZZA,KR20100121179 (A),17/11/2010,KIM JONG TAE [KR],KIM JONG TAE [KR],B65D85/36; B65D5/44; B65D5/54; B65D25/20,,KR20090040220,20090508,KR20090040220 20090508,,,,,,,,,,,,,,METHOD FOR PRODUCING PIZZA USING TOFU COMPRISING CURCUMA AROMATIC SALAB,KR20100119695 (A); KR101089216 (B1),10/11/2010,PARK GEUM SOON [KR],SUN MOK INST EDUCATION FOUNDATION [KR];  HAETTEURAK CO LTD [KR],A21D13/04; A21D8/04,,KR20090038767,20090501,KR20090038767 20090501,,,,,,,,,,,,,,Handle of pizza pan,CN201683776 (U),29/12/2010,JIANXIN REN,HAIYAN XINHUA ELECTRIC APPLIANCE CO LTD,A47J45/08,,CN20102110092U,20100129,CN20102110092U 20100129,,,,,,,,,,,,,,Pizza scoop,USD629684 (S1),28/12/2010,DRURY EVAN [CA],,,,US20100353712F,20100113,US20100353712F 20100113,,,,,,,,,,,,,,Oven burner,CN201672516 (U),15/12/2010,XIANGHUA LIU;  GANG WU,NINGBO JISHENG ELECTRICAL APPLIANCES CO LTD,F23D14/02; F23D14/46; F23D14/58; F23D14/62,,CN20102196543U,20100518,CN20102196543U 20100518,,,,,,,,,,,,,,DUAL DISK PIZZA CUTTER AND METHODS,US2010313432 (A1); US8539679 (B2),16/12/2010,CASWELL TY [US],CASWELL TY,B26B25/00; A47J43/00,B26B25/005,US20100813356,20100610,US20100813356 20100610; US20090186769P 20090612,US976496 (A); US1720305 (A); US1916725 (A); US3111914 (A); US3710444 (A); US4502223 (A); US4809437 (A); US6163966 (A); US2003233756 (A1); US2012096719 (A1); USD511075S (S1); US976496 (A); US1720305 (A); US1916725 (A); US3111914 (A); US3710444 (A); US4502223 (A); US4809437 (A); US6163966 (A); USD511075S (S1); US2003233756 (A1); US2012096719 (A1),,,,,,,,,,,,,Pizza pan,USD628848 (S1),14/12/2010,JUNKINS MITCH [US],,,,US20090344926F,20091006,US20090344926F 20091006; US20090338419F 20090611,,,,,,,,,,,,,,PIZZATOPPING AND A METHOD OF PRODUCING THE PIZZATOPPING,WO2010140894 (A1),09/12/2010,EREVIK JONE [NO],DAGENS AS [NO];  EREVIK JONE [NO],A21C9/04; A23L3/36; A23P1/08,A23L3/364; A21C9/04; A21D13/007; A23L1/0005; A23L1/0067,WO2010NO00203,20100602,NO20090002153 20090603; NO20100000791 20100601,,,,,,,,,,,US5894028 (A); US5243899 (A); WO9208358 (A1); EP1116445 (B1); US6753025 (B1),,,Collapsible pizza box with surface reliefs,GB2484127 (A),04/04/2012,THORLEY TREVOR [GB],ATLANTIC ENTPR 2009 LTD [GB],B65D5/42,B65D5/54; B65D85/36; B65D2585/366; B65D5/4266; B65D2585/366,GB20100016462,20100930,GB20100016462 20100930,GB2361912 (A); ES2263323 (A1); FR2456613 (A1); US2004217154 (A1),,,,,,,,,,,,,Pizza Business Model,US2010306136 (A1),02/12/2010,GOOLAB ANTHONY [US],,G06Q90/00,G06Q30/00; G06Q99/00,US20100774537,20100505,GB20090009440 20090601,US2002095231 (A1); US2005049922 (A1); US2006225579 (A1),,,,,,,,,,,,,Container with flyer disc member,US2010301105 (A1),02/12/2010,MCCLUNG III GUY LAMONTE [US],,B65D5/42; A63B67/00; A63H33/18,A63H33/18; A63B67/00; B65D81/36,US20100800650,20100519,US20010871170 20010531; US20100800650 20100519; US20010953094 20010914; US20040784543 20040223; US20060338435 20060124,US5492243 (A); US4838444 (A); US4195746 (A); US4014456 (A); US3908852 (A); US3768393 (A); US3757388 (A); US3670916 (A); US3484015 (A); US3360152 (A); US3335846 (A); US2695645 (A); US6789690 (B2); US4671423 (A); US4014450 (A); US3229809 (A),,,,,,,,,,,,,Pizza pan,USD628009 (S1),30/11/2010,SARNOFF NORTON [US];  PATEL RAJ [US],HANDI FOIL CORP [US],,,US20100362365F,20100525,US20100362365F 20100525,,,,,,,,,,,,,,,KR20100115893 (A),29/10/2010,LEE MI YOUNG [KR],LEE MI YOUNG [KR],A23P1/08; A23L3/36,,KR20090034531,20090421,KR20090034531 20090421,,,,,,,,,,,,,,AMINE DERIVATIVES OF MONASCUS PIGMENT INHIBITING DIFFERENTIATION OF PREADIPOCYTE 3T3-L1 CELLS,KR20100114682 (A),26/10/2010,SHIN CHUL SOO [KR];  WOO SOO HYUN [KR],IND ACADEMIC COOP [KR],A61K31/4741; A23L1/30; A61P3/04,,KR20090033187,20090416,KR20090033187 20090416,,,,,,,,,,,,,,VERSATILE COOKING DEVICE,US2010294138 (A1),25/11/2010,BRYCE DONALD WILLIAM [US];  WONG WING SUN FELIX [US];  ASHWORTH ROBERT SCOTT [US];  KAHN KRIS DAVID [US];  KEI CHAN SIU [US],JORDAN KAHN COMPANY [US],A47J37/07,A47J37/067; A47J37/0786,US20100757672,20100409,US20100757672 20100409; US20090180349P 20090521,US3295509 (A); US4640265 (A); US5365833 (A); US2003145740 (A1); US8181592 (B2),,,,,,,,,,,,,Protective sleeve of temperature controller,CN201655673 (U),24/11/2010,JIANMIN SHEN,JIANMIN SHEN,H01H37/04,,CN20092295553U,20091229,CN20092295553U 20091229,,,,,,,,,,,,,,Pizza packaging box,CN201647208 (U),24/11/2010,ZHONGHUANG LIU,SHANGHAI FOREIGN TRADE JIELONG COLOUR PRINTING CO LTD,B65D5/00; B65D85/36,,CN20102124126U,20100305,CN20102124126U 20100305,,,,,,,,,,,,,,TABLEWARE FOR PORTION CONTROL,US2010282761 (A1),11/11/2010,BARRECA EILEEN [US];  SPIEZIO SHEILA [US],,A47G19/00; A47G19/22,A47G19/2227; A47G19/025,US20100728435,20100322,US20090162382P 20090323; US20100728435 20100322,US652994 (A); USD194054S (S); US4373636 (A); US5341953 (A); US5853104 (A); US5925390 (A); US6296488 (B1); US6419107 (B1); USD481594S (S1); USD494012S (S1); US6889455 (B2); US7908181 (B2),,,,,,,,,,,,,Electric pizza baking pan with anti-scald structure,CN201624544 (U),10/11/2010,ZHAOFENG WU;  SHAOJIANG WANG,ZHAOFENG WU,A47J37/06,,CN20092271374U,20091118,CN20092271374U 20091118,,,,,,,,,,,,,,Systems and methods for making a pizza pie having an outer cheese portion,US7823489 (B1),02/11/2010,CRAIG TODD W [US];  GRAHAM PETER G [US];  NGUYEN JENNIFER T [US],PIZZA HUT INC [US],A21C11/12; A21C11/00; A21D13/00; B26B19/00,A21D13/007; Y10S83/932,US20090557053,20090910,US20090557053 20090910; US20050111467 20050421,US1545600 (A); US2304759 (A); US2598626 (A); US2791029 (A); US3716319 (A); US4661361 (A); US5196223 (A); US5720998 (A); US5775208 (A); US6286708 (B1),,,,,,,,,,,,,Cutter for pizza and other foods,US7823292 (B1),02/11/2010,CASTIGLIONE ROBERTO [US];  CASTIGLIONE TRAVIS [US],,B26B3/00,A21C15/04; A21C11/106; B26B25/005,US20060498490,20060803,US20060498490 20060803,US278103 (A); US482830 (A); US552267 (A); US677337 (A); US881828 (A); US895969 (A); US900300 (A); US1165022 (A); US1232398 (A); US1321215 (A); USD149551S (S); US2947084 (A); USD200335S (S); USD235704S (S); US4155142 (A); USD260223S (S); US4809437 (A); US4936466 (A); US4993157 (A); US5297010 (A); USD350462S (S); USD354887S (S); US5504998 (A); US5860217 (A); US6044565 (A); USD430475S (S); USD433912S (S); US6484407 (B2); USD479098S (S1); USD614925S (S1); US2004231475 (A1); US2009271993 (A1); JPS5228782 (A),,,,,,,,US4423551 (A); US4738028 (A); US5428898 (A); US5469622 (A); US5555625 (A); US6226824 (B1); US6955110 (B1); US2002129499 (A1),,,,,ROASTER,KR101045232 (B1); KR20100102948 (A),27/09/2010,LEE HYUN WOO [KR],LEE HYUN WOO [KR],A47J37/07; A47J37/04,,KR20090021278,20090312,KR20090021278 20090312,KR20090008578U (U); KR20020042213 (A); KR20010079524 (A),,KR20030047663 (A),,,,,,,,,,,ROASTER,KR101093530 (B1); KR20100102944 (A),27/09/2010,LEE HYUN WOO [KR],LEE HYUN WOO [KR],A47J37/04; A47J37/07,,KR20090021274,20090312,KR20090021274 20090312,,,,,,,,,,,,,,METHOD FOR MANUFACTURING RICE PIZZA,KR20100095907 (A),01/09/2010,LEE CHEON YONG [KR];  PARK CHUNG KIL [KR],PARIS CROISSANT CO LTD [KR],A21D13/04; A21D2/36; A21D8/04,,KR20090014953,20090223,KR20090014953 20090223,,,,,,,,,,,,,,DUAL WHEEL PIZZA CUTTER,US8011103 (B2); US2010269359 (A1),28/10/2010,BLUM MATTHEW [US],SEARS BRANDS LLC [US],B26B29/00,B26B25/005; A21C11/106; A21C15/04,US20090428637,20090423,US20090428637 20090423,US278103 (A); US312043 (A); US482830 (A); US552267 (A); US677337 (A); US881828 (A); US895969 (A); US900300 (A1); US1165022 (A); US1232398 (A); US1321215 (A); USD149551S (S1); US2947084 (A); USD199261S (S1); USD200335S (S1); US3281938 (A); USD207336S (S1); US3363314 (A); USD222380S (S1); USD235704S (S1); US3924328 (A); US4001936 (A); US4020550 (A); US4155142 (A); USD260223S (S1); US4738028 (A); US4809437 (A); US4993157 (A); US5299355 (A); USD350462S (S1); US5355588 (A); USD354887S (S1); USD355815S (S1); US5428898 (A); US5469622 (A); US5504998 (A); US5555625 (A); US5711077 (A); USD397001S (S1); US5860217 (A); US6044565 (A); USD430475S (S1); USD433912S (S1); US6484407 (B2); US6857192 (B1); US7591072 (B2); USD614460S (S1); USD614925S (S1); US7823292 (B1); US2004177515 (A1); US2004231475 (A1); US2007294898 (A1); US2008010838 (A1); US2010263217 (A1); JPS5228782 (A),,,,,,,,USD393987S (S1); USD448611S (S1); USD509114S (S1); USD519334S (S1),,,,,