Title,Publication number,Publication date,Inventor(s),Applicant(s),International classification,Cooperative Patent Classification,Application number,Date of application,Priority number(s),Patents cited in the search report,Literature cited in the search report,Patents cited during examination,Literature cited during examination,Other patent citations,Other literature citations,Patents used in opposition,Literature used in opposition,Patents cited by the applicant,Literature cited by the applicant,International search citation,International search NPL citation,Supplementary international search citation,Supplementary international search NPL citation"METHOD TO MAKE ""METROVA PIZZA"" (PIZZA ONE-METER LONG)",UA62543 (U),25/08/2011,SEREDIUK TARAS LEONIDOVYCH [UA];  SEREDIUK OKSANA IVANIVNA [UA],SEREDIUK TARAS LEONIDOVYCH [UA];  SEREDIUK OKSANA IVANIVNA [UA],A21D8/00; A23P1/00,,UA20110007354U,20110610,UA20110007354U 20110610,,,,,,,,,,,,,,METHOD FOR MAKING PIZZA,UA47666 (U),25/02/2010,KUBARA MYKHAILO MYKHAILOVYCH [UA],MARKET LTD LIABILITY COMPANY [UA],A21D8/00,,UA20070006667U,20070614,UA20070006667U 20070614,,,,,,,,,,,,,,Machine cutter for pizza,TWM391841 (U),11/11/2010,CHEN WEI-CHING [TW];  CHANG CHE-WEI [TW],UNIV YUANPEI [TW],A21C15/04,,TW20090223014U,20091209,TW20090223014U 20091209,,,,,,,,,,,,,,Inserting hole free pizza box,TWM375681 (U),11/03/2010,XIE SEN-FANG [TW],TRI CAN CO LTD [TW],B65D5/18,,TW20090219324U,20091020,TW20090219324U 20091020,,,,,,,,,,,,,,PIZZA CUTTER,CA128201 (S),11/09/2009,,WKI HOLDING CO INC [US],,,CA20080128201F,20081020,US20080306944F 20080418,,,,,,,,,,,,,,"FAT COMPOSITIONS AND RELATED METHODS, INCLUDING SHORTENING PARTICLES AND SHORTENING COMPOSITIONS WITHOUT ADDED NON-INTERESTERIFIED HARDSTOCK FAT, AND RELATED PRODUCTS",CA2835102 (A1),15/11/2012,SEIBOLD JON D [US];  ERICKSON BRADEN J [US];  OPPENHEIMER ALAN A [US],GEN MILLS INC [US],A23D9/00; A21D10/00; A21D13/00,A23D7/003; A23D7/02; A23D7/04; A23D9/02; A23D9/04; A21D2/16; A21D13/0058; C11C3/10,CA20122835102,20120426,US201161483951P 20110509; WO2012US35143 20120426,,,,,,,,,,,,,,SHORTENING PARTICLE COMPOSITIONS AND PRODUCTS MADE THEREFROM,CA2825521 (A1),09/08/2012,ERICKSON BRADEN J [US];  SEIBOLD JON D [US];  OPPENHEIMER ALAN A [US],GEN MILLS INC [US],A23D9/00; A21D10/00; A23D9/05,A23D9/00; A23D9/04; A23D9/05; A21D2/16; A21D10/005,CA20122825521,20120126,US201113017942 20110131; WO2012US22688 20120126,,,,,,,,,,,,,,METHOD AND APPARATUS FOR COOKING PIZZA,CA2816174 (A1),03/05/2012,GIORDANO GIUSEPPE [IT],GIORDANO GIUSEPPE [IT],A21D8/00; A21D13/00; A23B5/00,A21D8/06; A21D13/007; A21B3/13,CA20112816174,20111025,IT2010AL00029U 20101029; WO2011EP05359 20111025,,,,,,,,,,,,,,EQUIPPED WITH LEARNING CAPABILITIES FLYERS,KR20120136741 (A),20/12/2012,KIM JIN WOO [KR],KIM JIN WOO [KR],G09F23/10; B42D15/00; G09B19/02,,KR20110055873,20110610,KR20110055873 20110610,,,,,,,,,,,,,,STOVE FOR PIZZA ROASTED,KR20120136447 (A),20/12/2012,LEE JOO SEOK [KR];  LEE SEUNG HOON [KR],LEE JOO SEOK [KR];  LEE SEUNG HOON [KR],F24B1/182; A47J37/08,,KR20110055385,20110609,KR20110055385 20110609,,,,,,,,,,,,,,TOMATO-DERIVED THICKENING AGENT.,MX2012012652 (A),21/11/2012,MAVROUDIS NIKOLAOS [GB];  DUBBELMAN SANDER;  OLIEHOEK LEANDRO,UNILEVER NV [NL],A23L1/05; A23L1/0524; A23L1/212; A23L1/24,A23L1/05; A23L1/0524; A23L1/2128; A23L1/243,MX20120012652,20121030,EP20100161702 20100503; WO2011EP56150 20110418,,,,,,,,,,,,,,All-purpose knife for pizza,KR20120129273 (A),28/11/2012,,,B26B11/00; A21C15/04; B26B3/00; B26B25/00,,KR20110047427,20110519,KR20110047427 20110519,,,,,,,,,,,,,,A PACKING BOX FOR FOOD,KR20120126584 (A),21/11/2012,,,B65D85/36; B65D5/26; B65D5/462; B65D21/02,,KR20110044483,20110512,KR20110044483 20110512,,,,,,,,,,,,,,Pizza Box,KR200465505 (Y1); KR20120007840 (U),14/11/2012,,,B65D85/36; B65D5/22; B65D5/49; B65D5/66,,KR20110003918U,20110506,KR20110003918U 20110506,JPS631761U (U); KR200419658Y (Y1),,KR200351523Y (Y1); KR200402879Y (Y1),,,,,,,,,,,Cheese rice,KR20120122836 (A),07/11/2012,,,A23L1/182; A23L1/10,,KR20110042122,20110429,KR20110042122 20110429,,,,,,,,,,,,,,THE PIZZA DISPENSER,KR20120120863 (A),02/11/2012,,,B65D85/36; B65D5/20; B65D75/02,,KR20110038677,20110425,KR20110038677 20110425,,,,,,,,,,,,,,Pizza baking rack,CN202619437 (U),26/12/2012,LI HONGBO,SUZHOU WEIRUIDA MACHINERY TECHNOLOGY CO LTD,A47J37/06,,CN20122289808U,20120620,CN20122289808U 20120620,,,,,,,,,,,,,,Single-layer and double-layer switchable pizza baking frame,CN202619436 (U),26/12/2012,LI HONGBO,SUZHOU WEIRUIDA MACHINERY TECHNOLOGY CO LTD,A47J37/06,,CN20122289807U,20120620,CN20122289807U 20120620,,,,,,,,,,,,,,"Pizza Box Stacker, Carrier and Dispenser",US2012325842 (A1),27/12/2012,RESTAINO RUSTY A [US],RESTAINO RUSTY A [US],B65G59/06; B65D83/00,B65D83/0864; B65D2583/0431,US201113213861,20110819,US201113213861 20110819; US201113166154 20110622,,,,,,,,,,,,,,"Pizza Box Stacker, Carrier and Dispenser",US2012325841 (A1),27/12/2012,RESTAINO RUSTY A [US],RESTAINO RUSTY A [US],B65G59/06; B31B3/00; B65D83/00,B65D83/0864; B65D2583/0431,US201113166154,20110622,US201113166154 20110622,,,,,,,,,,,,,,Invertible Dispenser for Pizza Boxes of Multiple Sizes,US2012325840 (A1),27/12/2012,RESTAINO RUSTY A [US],RESTAINO RUSTY A [US],B65G59/06; B65D83/00,B65D83/0858; B65D2583/0431,US201213454936,20120424,US201213454936 20120424; US201113166154 20110622,US593132 (A); US2819819 (A); US3156378 (A); US3164298 (A); US3278080 (A); US3599830 (A); US3786959 (A); US3809287 (A); US4109980 (A); US4170325 (A); US5295592 (A); US5328258 (A); US5407094 (A); US6000589 (A); US7287668 (B1); US2012018503 (A1); US2012012605 (A1),,,,,,,,,,,,,DISPOSABLE PIZZA-BLOTTING COMPOSITE AND BOX ASSEMBLY INCLUDING SUCH COMPOSITE,US2012325834 (A1),27/12/2012,FARRELL BRADLEY HUNTER [US];  STITZ JENNIFER [US],FARRELL BRADLEY HUNTER [US];  STITZ JENNIFER [US],B65D90/00; B32B3/30; B32B5/02,B32B5/08; B32B7/02; B32B15/14; B65D81/264; B65D5/563; B32B2262/062; B32B2307/7163; B32B2307/726; B32B2307/7265; B32B2553/00; B65D2585/366; Y10T428/24612,US201113169927,20110627,US201113169927 20110627,,,,,,,,,,,,,,EASILY DISPOSABLE MODULAR CONTAINER FOR PIZZA AND THE LIKE,PT2094572 (E),26/11/2012,VOLZ WILLIAM [US];  WARE BRADY NEAL [US],VOLZ WILLIAM [US];  WARE BRADY NEAL [US],B65D5/20; B65D5/355; B65D5/54,B65D5/5475; B65D2585/366,PT20070809674T,20070618,US20060814924P 20060619; US20060859331P 20061115,,,,,,,,,,,,,,Novel pizza knife,CN202592394 (U),12/12/2012,CHEN SHANGYING,CHEN SHANGYING,B26B3/02,,CN20122270626U,20120606,CN20122270626U 20120606,,,,,,,,,,,,,,Simple manual pressure pizza cutter,CN102814823 (A),12/12/2012,ZHANG XINHUA;  CHEN CONGCONG,UNIV SHAOXING,B26B3/02; B26B9/02,,CN20121326254,20120906,CN20121326254 20120906,,,,,,,,,,,,,,CONVENIENT PIZZA,KR20120117258 (A),24/10/2012,KO DAE SUN [KR],KO DAE SUN [KR],A21D13/00; A21D15/08,,KR20110034908,20110415,KR20110034908 20110415,,,,,,,,,,,,,,COMPOSITION FOR TREATMENT OF PANCREATIC CANCER AND FUNCTIONAL FOOD COMPRISING EXTRACT OF CANNABIS SEMEN,KR20120111126 (A),10/10/2012,HWANG SUNG YEOUN [KR];  JEONG KYUNG CHAE [KR],KOREA BIO MEDICAL SCIENCE INST [KR];  HWANG SUNG YEOUN [KR];  JEONG KYUNG CHAE [KR],A61K36/185; A61P35/00,,KR20110029448,20110331,KR20110029448 20110331,,,,,,,,,,,,,,OVEN BAKED PIZZA BY INFRARED LAMPS,KR20120110892 (A); KR101206627 (B1),10/10/2012,RYU JAE DON [KR],RYU JAE DON [KR],A21B1/42; A21B1/02,,KR20110029068,20110330,KR20110029068 20110330,,,,,,,,,,,,,,CUPPIZZA AND MANUFACTURING METHOD THEREOF,KR20120109134 (A),08/10/2012,WON KIL HO [KR],GN FOOD CO LTD [KR],A21D13/00; A23L1/39,,KR20110027332,20110328,KR20110027332 20110328,,,,,,,,,,,,,,AUTOMATED PIZZA PREPARATION AND VENDING SYSTEM,US8710408 (B2); US2012308702 (A1),06/12/2012,KHATCHADOURIAN PUZANT [US];  PAPAKHIAN DANIEL [US];  KNELLER MIKHAIL [US];  YEUNG GEORGE [US],KHATCHADOURIAN PUZANT [US];  PAPAKHIAN DANIEL [US];  KNELLER MIKHAIL [US];  YEUNG GEORGE [US];  K & G ENTPR LLC [US],A21B1/42; A23L1/01,A21C9/04; A21C11/006; A21D8/02; A21D13/007; A21C5/00,US201213467568,20120509,US201213467568 20120509; US201213353123 20120118; US201161433928P 20110118,US3884213 (A); US4154861 (A); US4718535 (A); US3734271 (A); US4354796 (A); US5211106 (A); US5996476 (A); US2007108177 (A1); US7655884 (B2); US8011293 (B2); US2012185086 (A1); US8297270 (B2); US3734271 (A); US3884213 (A); US4154861 (A); US4354796 (A); US4718535 (A); US5211106 (A); US5996476 (A); US7655884 (B2); US8011293 (B2); US8297270 (B2); US2007108177 (A1); US2012185086 (A1),,,,,,,,US4737092 (A); US5921170 (A); US6398539 (B1); US7241977 (B2); WO2008103907 (A1),,,,,Reusable Pizza Box,US2012305634 (A1),06/12/2012,VONALST ROBERT LEROY [US],VONALST ROBERT LEROY [US],B65D5/66; B65D43/14,B65D85/36; B65D2585/366,US201113152583,20110603,US201113152583 20110603,US5110039 (A); US5190213 (A); US5402930 (A); US7188629 (B2); US2007083068 (A1),,,,,,,,,,,,,PIZZA OVEN ACCESSORY FOR A BARBECUE,WO2012159131 (A1),22/11/2012,SNYMAN ANTON [ZA],SNYMAN ANTON [ZA],A47J37/04; A47J37/07,A47J37/043; A47J37/0658; A47J37/0786,WO2012ZA00033,20120516,ZA20110003655 20110519,,,,,,,,,,,GB2465880 (A); CN201310929Y (Y); US3657996 (A); US6799567 (B1),,,METHOD FOR MANUFACTURING AN ICE-CREAM FILLED PIZZA,WO2012156560 (A1),22/11/2012,PENSADO RIVAS GONZALO [ES],PANADERIA RIAL S L [ES];  PENSADO RIVAS GONZALO [ES],A21D13/00,A23G9/48; A23G9/506; A21D13/0022; A21D13/0041; A21D13/007; A21D8/02,WO2012ES70331,20120510,ES20110000529 20110513,,,,,,,,,,,US2009285945 (A1),XP008171741; XP008171742,,Pizza tray,CN202525836 (U),14/11/2012,GAO JUN;  LIFAN SUN;  JIALE HU,SHANGHAI QIBAO HIGH SCHOOL,A47G23/06,,CN20122167288U,20120418,CN20122167288U 20120418,,,,,,,,,,,,,,Pizza oven,USD670528 (S1),13/11/2012,LIN KING-YUAN [US],LIN KING-YUAN [US],,,US201129395195F,20111216,US201129395195F 20111216,,,,,,,,,,,,,,COMPOSITION COMPRISING HEDYOTIS DIFFUSA EXTRACT FOR PREVENTION OR TREATMENT OF NONALCOHOLIC FATTY LIVER DISEASE,KR20120097080 (A); KR101292931 (B1),03/09/2012,KIM JUNG IN [KR];  KANG MIN JUNG [KR];  KIM JI HYE [KR];  CHOI HA NEUL [KR];  JEONG SOO MI [KR];  KIM MIN JU [KR];  DO JONG MOOK [KR],UNIV INJE IND ACAD COOPERATION [KR],A61K36/748; A61P1/00; A61P1/16,,KR20110016416,20110224,KR20110016416 20110224,KR19990038424 (A); KR20040043092 (A); KR19990038425 (A); KR20000061327 (A),,,,,,,,,,,,,"MANUFACTURING APPARATUS FOR WELL-BEING FISH PIZZA WITH ALTERATION FUNCTION, AND MANUFACTURING METHOD THEROF",KR20120097036 (A),03/09/2012,KIM TAE WOO [KR],UK HYUN INTERNAT [KR],A21B5/03; A21D13/00,,KR20110016350,20110224,KR20110016350 20110224,,,,,,,,,,,,,,PIZZA WITH PERIPHERAL CRUST STRUCTURE,CA2792833 (A1),30/09/2010,MATTHEWS KEVIN P [US],MATTHEWS KEVIN P [US],A21D13/00,A21D13/007,CA20102792833,20100219,US20090409144 20090323; WO2010US24663 20100219,,,,,,,,,,,,,,Pizza container,USD670162 (S1),06/11/2012,SEGAL ALEXANDER [CA],SEGAL ALEXANDER [CA],,,US201229371958F,20120222,US201229371958F 20120222,,,,,,,,,,,,,,"Cooking device i.e. light wave oven, for use in fitted kitchen for heating food product i.e. pizza, in cooking chamber, has infrared heating element arranged in lower side of housing behind glass plate that is connected with drawer",DE102011101042 (A1),15/11/2012,BOCKS STEFAN [DE];  HARLANDER FLORIAN [AT],GRONBACH FORSCHUNGS UND ENTWICKLUNGS GMBH & CO KG [AT],F24C7/06; F24C15/16,A47J37/0629; A47J37/0658; F24C7/06; F24C15/162,DE201110101042,20110510,DE201110101042 20110510,DE10203606 (A1); DE10241486 (A1); DE10356915 (A1); EP1513374 (A2),,,,,,,,DE10203606 (A1),,,,,Reproduced cheese and preparation method thereof,CN102742664 (A); CN102742664 (B),24/10/2012,YUANRONG ZHENG;  ZHENMIN LIU;  BEIHONG MO;  SHUAI CHEN;  HONGYAN GAO;  CHUNQUAN SHI;  YONGBIAO LING,BRIGHT DAIRY & FOOD CO LTD,A23C19/082,,CN20121213180,20120626,CN20121213180 20120626,CN102450335 (A); CN101564062 (A); CN102239926 (A); US2006083820 (A1),,,,,,,,,,,,,AUTOMATED PIZZA ASSEMBLY SYSTEM,CA2791135 (A1),01/09/2011,FRITZ-JUNG CATHRYN [US];  SCRIVANO DAVID [US];  STROTHER DAVID [US];  THOMAS AMANDA B [US];  HESLIP SEAN M [US];  DEEMTER KENT A [US];  MCCOY TYLER W [US];  HOEKSEMA BRET A [US],LITTLE CAESAR ENTPR INC [US],A21C9/04; A21C9/08,B25J11/00; A21C9/04,CA20112791135,20110224,WO2011US25989 20110224; US20100308487P 20100226; US20100320337P 20100402; US201113033650 20110224,,,,,,,,,,,,,,METHOD AND SYSTEM FOR MORE ACCURATELY DETERMINING NUTRITIONAL VALUES AND REDUCING WASTE OF FOOD ITEMS,CA2790612 (A1),25/08/2011,SPRIEGEL ANDREW R [US];  GETZINGER GREG T [US],SPRIEGEL ANDREW R [US];  GETZINGER GREG T [US],A47J43/00,A47J43/18; A47J47/005,CA20112790612,20110222,US20100339139P 20100222; WO2011US00341 20110222,,,,,,,,,,,,,,"Transport and presentation package for goods such as pizza, has spring element for pushing goods in direction of removal opening, which is passed from locked position into activated position through opening in the packaging portion",DE102011002285 (A1),31/10/2012,,THIMM VERPACKUNG GMBH & CO KG [DE],B65D5/72; B65D5/50; B65D5/52,B65D83/0817; B65D5/72; B65D25/101,DE20111002285,20110427,DE20111002285 20110427,DE202010009056U (U1); GB2227010 (A),,,,,,,,,,,,,METHOD FOR PRODUCING RICE CAKE STUFFED WITH INGREDIENT,JP2012175961 (A),13/09/2012,,TAKAHASHI MASATO,A23L1/10,,JP20110057190,20110225,JP20110057190 20110225,,,,,,,,,,,,,,METHOD FOR BAKING NEAPOLITAN TYPE PIZZA CRUST AND DEVICE FOR BAKING THE SAME,JP2012165687 (A),06/09/2012,,MITSUWA CO LTD,A21D8/06; A21B1/24,,JP20110029123,20110214,JP20110029123 20110214,,,JP2001505064 (A); JP2006141318 (A); JP2007029010 (A),,,,,,,,,,,Method and Apparatus for Cooking Pizza,US2012258229 (A1),11/10/2012,MINDRUP JEF [US],MINDRUP JEF [US],H05B3/68; A21D13/08,A21D8/06; A21D13/007,US201213444634,20120411,US201213444634 20120411; US201161474038P 20110411,US2007272398 (A1),,,,,,,,,,,,,REFRIGERATOR WITH AUXILIARY BASKET,US2012255322 (A1),11/10/2012,HAN JAE MYUNG [US];  LIM JAE HOON [KR],HAN JAE MYUNG [US];  LIM JAE HOON [KR];  SAMSUNG ELECTRONICS CO LTD [KR],F25D11/02,F25D23/067; F25D25/025; F25D23/021; F25D2331/804; F25D2331/809,US201213529431,20120621,US201213529431 20120621; KR20070017465 20070221; KR20070063159 20070626; US20070984214 20071114,DE19646206 (A1); US7111914 (B2); US6997526 (B2); US6799818 (B2); US2001054296 (A1); US6447083 (B1); US5758512 (A); US2005210655 (A1); US4751826 (A); US2006260353 (A1),,,,,,,,,,,,,Multifunctional pizza dish,CN202477187 (U),10/10/2012,XIA YANG,CHONGQING BAXIAN MIDDLE SCHOOL,A47G19/02,,CN20122117361U,20120322,CN20122117361U 20120322,,,,,,,,,,,,,,Corn pizza forming die,CN102715206 (A),10/10/2012,JIANYING TANG;  JIANMEI TANG,SUZHOU HAODELAI FOOD CO LTD,A21C11/00,,CN20121157724,20120522,CN20121157724 20120522,,,,,,,,,,,,,,"PLANT-BASED FOOD PRODUCT, COMPOSITION, AND METHODS",US2012251686 (A1),04/10/2012,MARGOLIS GEOFFREY [US],MARGOLIS GEOFFREY [US],A23L1/231; A23J1/00; A23J1/09; A23J3/00; A23L1/27,A23J3/04; A23J3/16; A23J3/18; A23J3/227,US201213428951,20120323,US201213428951 20120323; US201161469050P 20110329,US4250198 (A); US3953611 (A); US4265917 (A); US2006233938 (A1); EP0094112 (A1); WO9428738 (A1),,,,,,,,,,,,,"FOOD COMPOSITION, PHARMACEUTICAL COMPOSITION AND ANIMAL MEDICINE AGAINST OBESITY CONTAINING GINGERENONE A",KR101174701 (B1),17/08/2012,SEOK SU JIN [KR];  LEE KI WON [KR],SNU R&DB FOUNDATION [KR],A23L1/30; A23L2/38; A61K31/045; A61P3/04,A23L1/30; A61K31/12,KR20110146238,20111229,KR20110146238 20111229,,,,,,,,,,,,,,APPARATUS AND METHODS FOR REHEATING WEDGE SHAPED FOOD PRODUCTS,WO2012129364 (A1),27/09/2012,POKOTYLO JOHN C [US],POKOTYLO JOHN C [US],A47J43/28; A47G21/10; A47J45/10,A23L1/0128; A47J43/283,WO2012US30040,20120322,US201161466406P 20110322; US201213426370 20120321,,,,,,,,,,,US5551741 (A); CN2407699Y (Y); FR2734466 (A1),,,PIZZA-MAKING SYSTEM,WO2012128429 (A1),27/09/2012,YANG SUNGKI [KR],PIZZA KOREA CO LTD [KR];  YANG SUNGKI [KR],A21B7/00; A21B5/00; A21C9/04; A21C15/00,A21D13/007,WO2011KR06125,20110819,KR20110025309 20110322,,,,,,,,,,,US5529797 (A); KR20000068789 (A); US2006115557 (A1); KR100296512B (B1),,,"Device for cutting foodstuff e.g. pizza, has cutting tool that is designed as thermal cutting tool, for cutting to-be-cut material",DE102011016708 (A1),11/10/2012,DEVRAN SEZEK [DE],DEVRAN SEZEK [DE],B26F3/08; B26D3/24; B26D3/30; B26F3/12,B26D3/24; B26F3/08; B26F3/12,DE20111016708,20110411,DE20111016708 20110411,DE2343911 (A1); DE2732878 (A1),,,,,,,,,,,,,PIZZA CONTAINING QUERCETIN AND METHOD THEREOF,KR20120086991 (A),06/08/2012,GIM HYEONG GON [KR],JEONBUK CITY MAN INST [KR];  IM SILGUN [KR],A21D13/04; A21D8/06; A23L1/39,,KR20110008398,20110127,KR20110008398 20110127,,,,,,,,,,,,,,Pizza scissors,CN202448152 (U),26/09/2012,FANGHUA CAI,FANGHUA CAI,B26B13/22,,CN20112567554U,20111230,CN20112567554U 20111230,,,,,,,,,,,,,,Artificial cheese and preparation method thereof,CN102687757 (B); CN102687757 (A),26/09/2012,YUANRONG ZHENG;  ZHENMIN LIU;  BEIHONG MO;  CHUNQUAN SHI;  HONGYAN GAO;  SHUAI CHEN;  YONGBIAO LING,BRIGHT DAIRY CO LTD,A23C19/09; A23C19/093,,CN20121213242,20120626,CN20121213242 20120626,CN102450335 (A); JPH05292881 (A); US7579033 (B2),,,,,,,,,,,,,Processed cheese and preparation method thereof,CN102687753 (B); CN102687753 (A),26/09/2012,YUANRONG ZHENG;  ZHENMIN LIU;  BEIHONG MO;  HONGYAN GAO;  SHUAI CHEN;  CHUNQUAN SHI;  YONGBIAO LING,BRIGHT DAIRY CO LTD,A23C19/082; A23C19/093,,CN20121213224,20120626,CN20121213224 20120626,CN102370008 (A); CN102265934 (A); US2006083820 (A1),,,,,,,,,,,,,Pizza former,CN202436025 (U),19/09/2012,LINGSHENG KONG,LANGFANG SHENGXING FOOD MACHINERY CO LTD,A21D13/00,,CN2012211658U,20120112,CN2012211658U 20120112,,,,,,,,,,,,,,High-efficiency and energy-saving food baking oven,CN202425573 (U),12/09/2012,XIANG LIANG,XIANG LIANG,A23N12/08; A21B1/14; A23N12/12,,CN2012229988U,20120117,CN2012229988U 20120117,,,,,,,,,,,,,,Fuel gas pizza oven,CN202425507 (U),12/09/2012,FULI WANG;  WENDONG CUI;  WENKANG XIE;  ZHANGWEN PAN,YINGLIANSITE GUANGZHOU CATERING EQUIPMENT CO LTD,A21B5/02,,CN20112562316U,20111229,CN20112562316U 20111229,,,,,,,,,,,,,,PIZZA SANDWICH.,MX2012004269 (A),22/05/2012,GREINER STEVEN P [US];  DODD KRISTIN N;  CONWAY BERNARD WILLIAM;  YOST RACHEL MICHELLE;  FOSTER LISA A;  STOCKWELL PATRICIA,NESTEC SA [CH],A21D13/00,A21D13/007; A21D13/0025,MX20120004269,20120411,US20090609638 20091030; WO2010EP64297 20100928,,,,,,,,,,,,,,"Pre-formed cheese layer for pizza with channels, typically cylindrical, for strenght during handling, with even layer when cooked",NZ577413 (A),31/08/2012,YOUNG IAN,PUCK HOLDINGS PTY LTD,A23L1/025; A01J25/10; A23C19/00; A23P1/10; A23P1/12,A23C19/09; A23P1/10; A23P1/12; A01J25/12; A01J25/13; A21C9/04; A23L1/0073; A23L1/0076; B29C47/92,NZ20070577413,20071129,AU20060906672 20061129; WO2007AU01843 20071129,,,,,,,,,,,,,,PIZZA rotating tool,CN202408552 (U),05/09/2012,WENQING LI,WENQING LI,A47J37/06; A47J37/01,,CN20112441625U,20111103,CN20112441625U 20111103,,,,,,,,,,,,,,BAKEABLE PARCHMENT TRAY FOR BAKING PIZZA,WO2012115699 (A1),30/08/2012,FRITZ-JUNG CATHRYN [US];  KAKISH HIBA [US];  REBANT JASON E [US],LITTLE CAESAR ENTPR INC [US];  FRITZ-JUNG CATHRYN [US];  KAKISH HIBA [US];  REBANT JASON E [US],B65D81/34,A21B3/131; A21B3/133; B65D37/00; B65D81/343; B65D81/3453; B65D2581/3406,WO2011US64361,20111212,US201161446088P 20110224; US201113079102 20110404,,,,,,,,,,,US5203491 (A); US5511680 (A); US6062466 (A); US2005284906 (A1); US5401101 (A),,,PIZZA SAVER WHICH CAN BE FORK,KR20120082966 (A),25/07/2012,AHN KWANG JUN [KR],AHN KWANG JUN [KR],B65D85/36; A47G21/02; B65D57/00,,KR20110004319,20110116,KR20110004319 20110116,,,,,,,,,,,,,,Method and system for more accurately determining nutritional values and reducing waste of food items,US2012210841 (A1),23/08/2012,GETZINGER GREG T [US];  SPRIEGEL ANDREW RAYMOND [US],GETZINGER GREG T [US];  SPRIEGEL ANDREW RAYMOND [US];  NUVO GRAND LLC [US],B26D3/24; A47J47/00,A47J47/005; B26D3/24,US20110932296,20110222,US20110932296 20110222,USD657209S (S1); US4100676 (A); US2906020 (A); US2005011074 (A1); US3060838 (A); US2007108170 (A1); US1072450 (A); USD434953S (S),,,,,,,,,,,,,Pizza scissors,CN102630714 (A),15/08/2012,YANHONG WANG,SUZHOU INST TRADE & COMMERCE,A21C15/04,,CN20121143140,20120510,CN20121143140 20120510,CN201500993U (U); CN202680354U (U); CN201585942U (U); US4114265 (A); CN2466101Y (Y); US2182726 (A),,,,,,,,,,,,,The food that forms heart shape when cut,KR20120058353 (A),07/06/2012,LEE CHI GYU [KR],LEE CHI GYU [KR],A23G1/22; B26D3/24,A23G1/0053; A23G1/50; B26F1/44; B26F2001/4481,KR20100120088,20101129,KR20100120088 20101129,,,,,,,,,,,,,,PIZZA DOUGH AND ITS MANUFACTURING METHOD,KR20120057718 (A),07/06/2012,JUNG CHUL JUN [KR],JUNG CHUL JUN [KR],A21D13/00; A21D2/36,,KR20100082401,20100825,KR20100082401 20100825,,,,,,,,,,,,,,BROILED DISH OF SLICED RICE CAKE WITH PIZZA AND METHOD FOR MANUFACTURING THEREOF,KR20120055984 (A),01/06/2012,SEOL SEUNG SEOB [KR],KANG PHIL WON [KR],A23L1/10; A23P1/08,,KR20100117472,20101124,KR20100117472 20101124,,,,,,,,,,,,,,low price and easy assemble pizza box,KR20120002671 (U),19/04/2012,,,B65D85/36; B65D5/22; B65D5/26; B65D5/66,,KR20100010406U,20101011,KR20100010406U 20101011,,,,,,,,,,,,,,Energy-saving efficient pizza pan,CN202355254 (U),01/08/2012,LIHUA HUANG,ZHANJIANG ZHONGRONG ELECTRIC APPLIANCE CO LTD,A47J37/06,,CN20112518633U,20111213,CN20112518633U 20111213,,,,,,,,,,,,,,Multifunctional pizza pan,CN202355249 (U),01/08/2012,SHUGUANG QI,HUBEI BIAOHUA ELECTRICAL APPLIANCE TECHNOLOGY CO LTD,A47J37/06,,CN20112437670U,20111108,CN20112437670U 20111108,,,,,,,,,,,,,,Multifunctional pizza dish,CN202355020 (U),01/08/2012,MENTIONED THE INVENTOR HAS WAIVED THE RIGHT TO BE,SU YIJUN,A47G19/02,,CN20112405043U,20111023,CN20112405043U 20111023,,,,,,,,,,,,,,Grapefruit flesh and peel mixed stuffing,CN102613509 (B); CN102613509 (A),01/08/2012,JUAN WANG;  JIHONG HUANG,JUAN WANG,A23L1/212; A23L1/09,,CN20121121604,20120424,CN20121121604 20120424,CN101057688 (A); CN101438777 (A); CN101703180 (A); CN102138617 (A),,,,,,,,,,,,,Pizza box,CN202346173 (U),25/07/2012,HUAN XING;  WEI HUANG,UNIV ZHEJIANG TECHNOLOGY,B65D85/36; B65D5/64; B65D81/36,,CN20112318211U,20110829,CN20112318211U 20110829,,,,,,,,,,,,,,"Carrier structure for food carrier for e.g. pizza, has receiving device aligned parallel to base-food carrier in mounted state and in pre-defined position in horizontal and vertical directions relative to base-food carrier",DE102010064198 (A1),28/06/2012,ANDREAS MARGIT [DE];  HERBOLSHEIMER JOCHEN [DE];  LEBACHER ANNA [DE];  LEBACHER RAINER [DE];  VAROL NECATI EFE [DE],BSH BOSCH SIEMENS HAUSGERAETE [DE],F24C15/16; A21B3/15,F24C15/16,DE20101064198,20101227,DE20101064198 20101227,,,,,,,,,DE202006010579U (U1),,,,,BAKING OVEN,JP2012115220 (A),21/06/2012,,HOMES COFFEE KK,A21B1/04; A21B3/00,,JP20100269322,20101202,JP20100269322 20101202,,,JP2002247946 (A); JP2003061558 (A),,,,,,,,,,,Reusable Pizza Pan Set,US2012175367 (A1),12/07/2012,LOPES SUSAN [US];  SAAKE JEFFREY [US],LOPES SUSAN [US];  SAAKE JEFFREY [US],B65D51/00,B65D25/14; B65D43/0222; B65D51/1611; B65D2543/00092; B65D2543/00277; B65D2543/00407; B65D2543/00527; B65D2543/00537; B65D2585/366,US201213344902,20120106,US201213344902 20120106; US201161430582P 20110107,US6257434 (B1); US5585027 (A); US3938726 (A); US2010155358 (A1); US6188055 (B1); US5565125 (A); US5472139 (A); US6100514 (A); US3335846 (A); US7980412 (B2); US7942268 (B2); US5605231 (A); US5543606 (A); US5076434 (A); US4848543 (A); US4373636 (A); US2009057381 (A1); US4883195 (A); US1945397 (A); US5352465 (A); US4260060 (A); US6095324 (A); US4304106 (A); US6019511 (A); US4360118 (A); US3484015 (A); US6627862 (B1); US2006147588 (A1); US2012024859 (A1); US2008296303 (A1); US8070116 (B1); US6056146 (A); US8192537 (B2); US8096437 (B1); US3958504 (A); US2011127282 (A1); US2008178747 (A1); US4933193 (A),,,,,,,,,,,,,Multifunctional pizza pot,CN202287881 (U),04/07/2012,HUIFENG ZHANG,HUIFENG ZHANG,A47J37/06,,CN20112392705U,20111014,CN20112392705U 20111014,,,,,,,,,,,,,,"MODULAR FOOD PREPARATION, COOKING, DINING, SERVING AND ENTERTAINMENT SYSTEM",WO2012164281 (A1),06/12/2012,SMITH WAYNE ANTHONY [GB],SMITH WAYNE ANTHONY [GB],A47J37/07,A47J37/0704; A47J37/0763,WO2012GB51211,20120530,GB20110009265 20110602,,,,,,,,,,,WO2010116217 (A1); DE102006006454 (A1); EP1588654 (A2); DE202005004673U (U1); US6513515 (B1); GB2465880 (A),,,Circulating Air Oven,US2012164591 (A1),28/06/2012,CHADWICK DANIEL SEBASTIAN [GB];  ADAMS GUY DE WARRENNE BRUCE [GB],CHADWICK DANIEL SEBASTIAN [GB];  ADAMS GUY DE WARRENNE BRUCE [GB],F24C3/00,F24B1/003; F24C15/10,US201013393734,20100826,GB20090015075 20090901; WO2010GB01610 20100826,,,,,,,,,,,,,,METHOD FOR MANUFACTURING NUREUNGJI DOUGH,KR101146239 (B1),15/05/2012,O JAE HYEON [KR];  KIM NAN YOUNG [KR],KIM NAN YOUNG [KR];  O JAE HYEON [KR],A23L1/10; A23L1/182,,KR20110125309,20111128,KR20110125309 20111128,KR100202266B (B1); KR100529823B (B1); KR20110131659 (A); KR100199517B (B1),,,,,,,,,,,,,COMPOSITION FOR PREVENTION OR TREATMENT OF RHEUMATOID ARTHRITIS COMPRISING THE PHOSPHOLIPASE D1 INHIBITOR,KR20120049508 (A),17/05/2012,MIN DO SIK [KR];  YOO HYUN JUNG [KR];  KANG DONG WOO [KR],PUSAN NAT UNIV IND COOP FOUND [KR],A61K31/4184; A61K31/445; A61P19/00; A61P19/02,A61K31/4184; A61K31/445,KR20100110791,20101109,KR20100110791 20101109,,,,,,,,,,,,,,COMPOSITION FOR PREVENTION OR TREATMENT OF OSTEOPOROSIS COMPRISING EXTRACT OF CIRSII HERBA,KR20120044450 (A),08/05/2012,MA JIN YEUL [KR];  SHIM KI SHUK [KR];  LEE YOON HEE [KR];  CHOI SUNG UP [KR];  UM YOUNG RAN [KR];  LEE JAE HOON [KR],KOREA INST ORIENTAL MEDICINE [KR],A61K36/28; A61P19/00; A61P19/10,,KR20100105726,20101028,KR20100105726 20101028,,,,,,,,,,,,,,