PIZZA BOX,US2010001051 (A1),07/01/2010,CASTIGLIONI CARLO [IT];  TAVOSO ANDREA [IT],,B65D5/00,B65D5/20; A47G21/001; B65D5/545; B65D81/36; B65D2585/366,US20070514018,20070809,WO2007EP07076 20070809; IT2006VR00171 20061109,,,,,,,,,,,,,,Pizza box,USD607321 (S1),05/01/2010,MARK JUSTIN A [US],,,,US20090333044F,20090302,US20090333044F 20090302,,,,,,,,,,,,,,Multi pizza packaging,EP2284086 (A1),16/02/2011,ZEREY MEHMET [TR];  OEZTUERK AHSEN [TR],OLMUKSA INTERNAT PAPER SABANCI AMBALAJ SANAYI VE TICARET ANONIM SIRKETI [TR],B65D5/00; B65D5/42; B65D5/66,B65D85/36; B65D2585/366,EP20100150186,20100106,TR20090006013U 20090804,US4971242 (A); DE3636686 (A1); FR2837465 (A1); US4984734 (A); EP0319493 (A1),,,,,,,,,,,,,"Pizza plate for use in kitchen of restaurant, has edge, and blocking unit forming overhang return unit to prevent pizza from slipping out of plate during transport without obstructing handling of covers during cutting of pizza",FR2948548 (B1); FR2948548 (A1),04/02/2011,MAHR DOMINIQUE [FR],MAHR DOMINIQUE [FR],A47G19/02,A47G19/02,FR20090055434,20090731,FR20090055434 20090731,US3076579 (A); US6299918 (B1); DE20114007U (U1); WO2007002439 (A1); US2005115974 (A1); US5381905 (A); FR2845880 (A1); FR527078 (A); JP2002315680 (A); US2009065514 (A1); WO2005007525 (A1),,,,,,,,,,,,,Rice pizza and making method thereof,CN101584359 (A); CN101584359 (B),25/11/2009,CHUNJIANG DU [CN],CHUNJIANG DU [CN],A21D13/08; A23L1/164,,CN20091118852,20090304,CN20091118852 20090304,,,,,,,,,,,,,,PIZZA AUTOMATIC VENDING MACHINE IS DRINK MAKING POSSIBILITY,KR20090100712 (A),24/09/2009,PARK KEUN SU [KR],WONDERPIZZA KOREA CO LTD [KR],G07F9/10,,KR20080026067,20080320,KR20080026067 20080320,,,,,,,,,,,,,,CUCUMBERS PROCESSING METHOD,RU2371009 (C1),27/10/2009,SHCHEPOCHKINA JULIJA ALEKSEEVNA [RU],SHCHEPOCHKINA JULIJA ALEKSEEVN [RU],A23L1/212,,RU20080124423,20080616,RU20080124423 20080616,,,,,,,,,,,,,,Industrial tunnel type wood burning oven for the baking of pizza and similar alimentary products,NZ563223 (A),30/10/2009,FERRO PIETRO,TECHNOFORNI S R L,A21B1/48,A21B1/02; A21B1/48,NZ20050563223,20050616,IT2005MI00934 20050523; WO2005EP52806 20050616,,,,,,,,,,,,,,MULTI-PIECE PIZZA WITH PERIPHERAL CRUST STRUCTURE AND METHOD AND APPARATUS FOR FORMING THE SAME,WO2009142818 (A1),26/11/2009,MATTHEWS KEVIN P [US],MATTHEWS KEVIN P [US],A21D8/00; A21D13/00,A21D13/007; A21D8/02,WO2009US38317,20090326,US20080122890 20080519,US2007180715 (A1); US2007116803 (A1); US5789009 (A); US5508049 (A),,,,,,,,,,,,,Pizza Truck,KR20090007020 (U),13/07/2009,,,B60P3/025; A21B1/00; A21B5/00; B60R99/00,,KR20080000246U,20080107,KR20080000246U 20080107,,,,,,,,,,,,,,VENDER FOR INSTANT PIZZA,KR20090073320 (A),03/07/2009,KIM KI JOON [KR];  YU KUN SOO [KR];  HWANG MYEONG GWON [KR],GREEN FORCE LTD [KR];  YU KUN SOO [KR];  KIM KI JOON [KR];  HWANG MYEONG GWON [KR],G07F9/10,,KR20070141235,20071231,KR20070141235 20071231,,,,,,,,,,,,,,Efficient food wraps,US2009285950 (A1),19/11/2009,BAKER ROBERT G [US],,A21D13/00,A21D13/0029; A21D13/009,US20080154115,20080519,US20080154115 20080519,US2668767 (A); US3773522 (A); US3669007 (A); US4961948 (A); US6165522 (A); US1732567 (A); US6024554 (A); US5306133 (A); US6168817 (B1); US5529799 (A); US3278311 (A),,,,,,,,,,,,,BAG,JP2009240743 (A),22/10/2009,KOBAYASHI SATOKO,KOBAYASHI SATOKO,A45C3/04,,JP20080114514,20080328,JP20080114514 20080328,,,JPH0568321U (U); JPS3934914Y (Y1),,,,,,,,,,,Container for frozen pizza,KR20090007971 (U); KR200446124 (Y1),05/08/2009,,,B65D81/34; B65D85/36,,KR20080001558U,20080201,KR20080001558U 20080201,JP2005082197 (A); JPH11227858 (A); KR880002409U (U); KR950003621Y (Y1),,,,,,,,,,,,,Pizza cutting apparatus,KR20090005080 (U),27/05/2009,,,A21C15/04; A21C15/00; A21D13/00,,KR20070018831U,20071122,KR20070018831U 20071122,,,,,,,,,,,,,,Oven for cone pizza,KR20090000940 (U),02/02/2009,,,A21B5/00; A21B5/02; A21B5/04,,KR20070012354U,20070725,KR20070012354U 20070725,,,,,,,,,,,,,,Pizza oven,KR20090008482 (U),24/08/2009,,,A47J37/08; A47J37/00; F24C3/00,,KR20080002202U,20080219,KR20080002202U 20080219,,,,,,,,,,,,,,METHOD FOR MANUFACTURING FREEZING PIZZA AND FREEZING PIZZA MANUFACTURED BY THE SAME,KR20090081515 (A),29/07/2009,JUNG WON YOUNG [KR],JUNG WON YOUNG [KR],A21D13/00,,KR20080007420,20080124,KR20080007420 20080124,,,,,,,,,,,,,,Pizza fixed device,KR20090002681 (U); KR200444117 (Y1),18/03/2009,,,B65D85/36; B65D57/00,,KR20070015280U,20070913,KR20070015280U 20070913,,,,,,,,,,,,,,pizza bag for delivery,KR20090000027 (U); KR200443498 (Y1),07/01/2009,,,A47J47/14; A45C11/20,,KR20070010619U,20070628,KR20070010619U 20070628,,,,,,,,,,,,,,Apparatus for forming disk-like elements of food dough,EP2174549 (A1); EP2174549 (B1),14/04/2010,BENETTI LUIGI [IT],ITECA S P A [IT],A21C11/00,A21C11/006,EP20090012886,20091012,IT2008VI00238 20081013,GB1192873 (A); US6398539 (B1); EP0695505 (A2); US5176922 (A); US6158315 (A),,,,,,,,,,,,,MANUFACTURING METHOD OF PIZZA SAUCE USING FIVE GRAINS,KR20090085459 (A); KR101016753 (B1),07/08/2009,KIM JONG GOO [KR],KIM JONG GOO [KR],A23L1/39; A23L1/10; A23L1/105; A23L1/221,,KR20080011366,20080204,KR20080011366 20080204,KR100810143B (B1); KR100539104B (B1); KR20090043961 (A),,,,,,,,,,,,,"Semi-rigid material cutout blank i.e. cardboard, for forming parallelepipedic shaped box to pack food product i.e. pizza, has foldable shutter and side pavements comprising mutual co-operation unit formed of tabs and notches",FR2945516 (B1); FR2945516 (A1),19/11/2010,COHEN SERGE [FR],COHEN SERGE [FR],B65D5/66,B65D5/302; B65D2101/0015; B65D2585/366,FR20090053157,20090513,FR20090053157 20090513,US5799864 (A); US2005274779 (A1); US2003150903 (A1); CH591369 (A5),,,,,,,,,,,,,Pizza serving utensil,USD601390 (S1),06/10/2009,KIRALY GYORGY [US],,,,US20080313057F,20081203,US20080313057F 20081203,,,,,,,,,,,,,,FROZEN MICROWAVEABLE DOUGH PRODUCTS.,MX2008013344 (A),07/01/2009,BLACK JOHN M [US],FIRST PRODUCTS INC [US],A21D13/02,A21D15/02; A21D10/02; A21D13/0006; A21D13/0022,MX20080013344,20081017,US20060793438P 20060420; US20060818951P 20060706; WO2007US65637 20070330,,,,,,,,,,,,,,BLENDABLE CHEESE SNACK.,MX2007009111 (A),18/02/2009,DELPIERRE PHILLIP III [US];  BRODY JOHN KIERAN;  KRAHN NANCY M;  KAUFMAN BRIAN L;  LINK KARL L,SARGENTO FOODS INC [US],A23C19/00,A23C19/09; A23L1/2123; A23L1/362; A23C2270/15; A23V2002/00; A23V2002/00; A23V2200/08,MX20070009111,20070727,US20060463354 20060809,,,,,,,,,,,,,,Microwave toaster,CN201314597 (Y),23/09/2009,AIMIN PENG [CN],MIDEA GROUP CO LTD [CN],F24C7/02,,CN20082202894U,20081031,CN20082202894U 20081031,,,,,,,,,,,,,,Pizza Pop-Ins,US2009245698 (A1),01/10/2009,MILLER DAVID T [US],,B65D33/04; B65D33/16,B65D31/18; B65D33/2508; B65D2585/366,US20080857973,20080331,US20080857973 20080331,,,,,,,,,,,,,,"Advertising medium for fixing at interior of cup of e.g. beverage, has small securing guides for inserting and fixing medium in paperboard container, where shape of medium is varied according to requests and specifications of customer",DE102008021245 (A1),29/10/2009,MEYER TOBIAS [DE];  PFORR THORBEN [DE],MP 2 TOBIAS MEYER & THORBEN PF;  THORBEN PFORR [DE],G09F23/06; G09F23/02; G09F23/10,G09F23/00; G09F23/06; G09F23/10,DE20081021245,20080428,DE20081021245 20080428,,,,,,,,,,,,,,Mechanized apparatus for the preparation of pizzas,EP2181599 (A2),05/05/2010,TOMATIS STEFANO [IT],CMT COSTR MECC & TEC [IT],A21B3/07,A21B3/07,EP20090011458,20090908,IT2008TO00144 20080228,,,,,,,,,EP1168926 (A1),,,,,Rolling pin for flattening pizza dough,EP2181600 (A2),05/05/2010,TOMATIS STEFANO [IT],CMT COSTR MECC & TEC [IT],A21C3/02,A21C3/021,EP20090011457,20090908,IT2008TO00143U 20081030,,,,,,,,,US2451170 (A),,,,,Method for Manufacturing a Decorative Pizza,US2009238924 (A1),24/09/2009,LAWHORN RICHARD C [US],,A23P1/00,A21D13/007; A21C9/04; A21C11/006; A21D13/0087,US20080050395,20080318,US20080050395 20080318,,,,,,,,,,,,,,Up-right carry-out,US7591496 (B1),22/09/2009,DE BECK THOMAS D [US],,A45F5/00,A45F5/00; A45C7/0054; A45C11/20; A45C13/02; A45C2007/0009,US20040986787,20041115,US20040986787 20041115,US1448866 (A); US1559046 (A); US4337812 (A); US4712673 (A); US5118033 (A); US5180894 (A); US5232258 (A); US5251945 (A); US5709913 (A); US5961043 (A); US6036085 (A); US6749064 (B1); US2002060167 (A1); US2003106899 (A1); EP0452167 (A1),,,,,,,,US1627583 (A); US1683678 (A); US1971322 (A); US2300874 (A); US3337046 (A); US5524949 (A); US6298992 (B1); USD462904S (S1),,,,,Rotary cutter,US2009223068 (A1),10/09/2009,SAWHNEY RAVI KUMAR [US];  BOTSAI KURT GREGORY [US];  GLUPKER CHRISTOPHER WARREN [US];  AYA TOSHIHIRO [US];  THOMAS LEAH LOUISE [US];  VERNON JOHN MARK [US],,B26B25/00; B26D3/00,B26B25/005,US20080074859,20080305,US20080074859 20080305,,,,,,,,,,,,,,Automatic Pizza Shaping Conveyor Device and Method,US2009220657 (A1),03/09/2009,YEN JEN-HO [TW],,A23L1/00; A21B1/48; A21C11/06; A21C11/10; A21C13/02; A21D6/00,A21C11/10; A21C9/04,US20070226768,20070427,TW20060207338U 20060428; WO2007CA00725 20070427,US6953596 (B2),,,,,,,,,,,,,Ceramic veneer glaze of electromagnetic furnace and method of producing the same,CN101508597 (A),19/08/2009,XIE WU [CN];  GUIYIN LI [CN];  ZHIDE ZHOU [CN];  XIAO ZHANG [CN],UNIV HUNAN [CN],C04B41/86,,CN2009142422,20090106,CN2009142422 20090106,,,,,,,,,,,,,,PIZZA,US2009208610 (A1),20/08/2009,SANCHEZ ZARZOSO MARIA ISABEL [ES],,A21D13/00; A23L1/16,A21D13/007,US20050576514,20050923,ES20040002236U 20041001; WO2005ES70132 20050923,,,,,,,,,,,,,,Automated Cheese Shredder For Applying Cheese To Pizza,US2009200408 (A1),13/08/2009,FRITZ-JUNG CATHRYN [US],LITTLE CAESAR ENTPR INC [US],A47J43/25,A47J43/255,US20080191004,20080813,US20080191004 20080813; US20070956508P 20070817,,,,,,,,,,,,,,Material conveyer belt with pizza slice shape riffled,CN201280328 (Y),29/07/2009,FEIPENG MA [CN],ZHEJIANG DONGNAN RUBBER BELT C [CN],B65G15/42,,CN20082137631U,20080919,CN20082137631U 20080919,,,,,,,,,,,,,,Material conveyer belt with pizza slice shape and head block riffled,CN201280327 (Y),29/07/2009,FEIPENG MA [CN],ZHEJIANG DONGNAN RUBBER BELT C [CN],B65G15/42,,CN20082137630U,20080919,CN20082137630U 20080919,,,,,,,,,,,,,,Material conveyer belt with deformation pizza slice type and safe edge riffled,CN201280325 (Y),29/07/2009,FEIPENG MA [CN],ZHEJIANG DONGNAN RUBBER BELT C [CN],B65G15/42,,CN20082137628U,20080919,CN20082137628U 20080919,,,,,,,,,,,,,,Material conveyer belt with deformation pizza slice type and safe edge riffled,CN201280324 (Y),29/07/2009,FEIPENG MA [CN],ZHEJIANG DONGNAN RUBBER BELT C [CN],B65G15/42,,CN20082137627U,20080919,CN20082137627U 20080919,,,,,,,,,,,,,,Material conveyer belt with deformation pizza slice type and safe edge riffled,CN201280322 (Y),29/07/2009,FEIPENG MA [CN],ZHEJIANG DONGNAN RUBBER BELT C [CN],B65G15/30,,CN20082137634U,20080919,CN20082137634U 20080919,,,,,,,,,,,,,,"Plastic pizza-mold has adjustable louvers in bottom area, adjustable spacers in bottom area, cover plate with adjustable louvers in lid area, adjustable louvers in base area and adjustable spacer in base area",DE102008011883 (A1),03/09/2009,KRAATZ DANIEL [DE],KRAATZ DANIEL [DE],A21B3/13; A47J37/01; B65D81/34,A47J36/04; A47J37/01; A21B3/15,DE20081011883,20080229,DE20081011883 20080229,,,,,,,,,,,,,,"Interactive centralized online sales system for visually modifiable food preparation forms in three dimensional virtual world, has interface connected to virtual world, where virtually offered articles is delivered in real world",DE102008011837 (A1),03/09/2009,,TECHLAB GMBH [DE],G06Q30/00,G06Q30/0603,DE20081011837,20080228,DE20081011837 20080228,,,,,,,,,,,,,,"Food i.e. pizza, plate carrier device, has adjustable ventilation openings provided at lower and upper regions of device, and food plate carrier exhibiting different height, width and breadth and manufactured from different materials",DE102008011662 (A1),03/09/2009,KRAATZ DANIEL [DE],KRAATZ DANIEL [DE],A47J39/02,A47J47/14; B65D2585/366,DE20081011662,20080228,DE20081011662 20080228,,,,,,,,,,,,,,"MODULAR PIZZA OVEN KIT, PIZZA OVEN FINGER ASSEMBLY SUPPORT, AND A METHOD OF OPERATING A PIZZA OVEN AT DIFFERENT SPEEDS AND A CONTROL ARRANGEMENT FOR PERFORMING THE METHOD",US8093533 (B2); US2009184103 (A1),23/07/2009,FRENCH MICHAEL [US];  BIELSTEIN MARK A [US],"FRENCH MICHAEL, ; BIELSTEIN MARK A",F27D11/00,A21B1/245,US20080336337,20081216,US20080336337 20081216; US20070014108P 20071217; US20080109883P 20081030,US6933473 (B2); US6998582 (B1),,,,,,,,,,,,,A holder on a vehicle seat,GB2470080 (A),10/11/2010,POOLE MARK [GB],POOLE MARK [GB],B60R7/04; B60N3/10,B60R7/043; B60N2002/4405; B60N3/103; B60R7/043,GB20090008800,20090521,GB20090007711 20090506; GB20090008578 20090519; GB20090008405 20090515,DE1256938 (B); FR2874866 (A1); FR2921600 (A1); US6079773 (A); US2004155080 (A1); US2007273183 (A1),,,,,,,,,,,,,METHOD FOR PREPARING OF BLACK SOYBEAN PIZZA,KR20090052588 (A),26/05/2009,LEE KEUN CHUL [KR];  PYO JAE HO [KR];  SUNG NAK JU [KR];  JO KUI IM [KR],LEE KEUN CHUL [KR];  PYO JAE HO [KR],A21D13/00; A23L1/20; A23L1/202,,KR20070119174,20071121,KR20070119174 20071121,,,,,,,,,,,,,,"Cereal-based food preparation, mainly containing oat bran, for industrial production of food products",EP2130441 (A1),09/12/2009,DUKAN PIERRE [FR],NDV DUAL LTD [GB],A23L1/10; A21D13/00; A21D13/04; A23L1/308,A23L1/308; A21D10/04; A21D13/007; A21D13/0077; A21D13/02; A21D13/04; A23L1/10; A23L1/1016,EP20090007106,20090528,FR20080003011 20080602; FR20080003909 20080709,WO02082929 (A1); US4824683 (A); US4497840 (A); EP1323355 (A1); US2004258826 (A1); AT400503B (B); US4698232 (A),,US2006008564 (A1); US6060519 (A),,,,,,,,,,,Improved warm food product distributor,CN101460062 (A),17/06/2009,MARCO BIANCHI [PT],MARCO BIANCHI [PT],A21C15/00,A21C15/007,CN2007820201,20070601,IT2006PI00061 20060601,,,,,,,,,,,,,,A PIZZA BOX,KR100892221 (B1),07/04/2009,JEONG JEONG IL [KR],JEONG JEONG IL [KR],B65D85/36,,KR20080041761,20080506,KR20080041761 20080506,KR200321355Y (Y1); US6568586 (B1); US4757937 (A),,KR200320088Y (Y1),,,,,,,,,,,Open pizza oven,CN201252789 (Y),10/06/2009,YIZHOU LU [CN];  JIE REN [CN],UNIV ZHEJIANG SCIENCES [CN],A21B5/00,,CN20082164641U,20080922,CN20082164641U 20080922,,,,,,,,,,,,,,GAS OVEN OF PIZZA USING DIRECT HOT AIR JET,KR100887754 (B1),12/03/2009,JEONG BONG SU [KR],JEONG BONG SU [KR],F24C3/00; F24C3/04,,KR20080107942,20081031,KR20080107942 20081031,KR100326959B (B1); KR20070109256 (A); KR20010000225U (U); KR20070091635 (A),,,,,,,,,,,,,"CLASSED BY DELIVERY,PAGE STRUCTURE",KR20090030389 (A),25/03/2009,SEO JIN SUN [KR],SEO JIN SUN [KR],G06Q50/12,,KR20070095653,20070920,KR20070095653 20070920,,,,,,,,,,,,,,CONEPIZZA MACHINE,KR20090025730 (A),11/03/2009,LEE HYO SEOP [KR],EANSKOREA CO LTD [KR],A21D6/00; A23P1/00; A23P1/10; A23P1/12,,KR20070090804,20070907,KR20070090804 20070907,,,,,,,,,,,,,,THE OVEN FOR THE CON PIZZA,KR100919697 (B1); KR20090022796 (A),04/03/2009,LEE TAE HO [KR],HAMIL F & C CO LTD [KR],F24C7/04; A21B1/00,,KR20070088426,20070831,KR20070088426 20070831,KR20030012038 (A); KR920012825 (A),,KR100789740B (B1),,,,,,,,,,,"Navigation system operating method for guiding vehicle i.e. car, to point of interest e.g. restaurant, involves determining route by using search results, and starting route guidance to destination by data processing unit",DE102008057198 (A1),02/07/2009,KAZAN SINAN [DE];  KEPPLER MARTIN [DE];  SENG UWE [DE];  WENZ MARTIN [DE];  ZIMMER RICHARD [DE],DAIMLER AG [DE],G01C21/34,G01C21/26,DE20081057198,20081113,DE20081057198 20081113,,,,,,,,,DE10244001 (A1); DE19927640 (A1); WO9210808 (A1),,,,,"Unpacked product e.g. pizza, evacuating and back-gassing method for food industry, involves evacuating and back-gassing one of product flows in vacuum chamber, when product is introduced or discharged in another vacuum chamber",DE102007060305 (A1); DE102007060305 (B4),02/07/2009,KAUL DIETER [DE],KAUL DIETER [DE],B65B31/02; B65B25/06,B65B25/001; B65B31/022,DE20071060305,20071212,DE20071060305 20071212,WO2004045951 (A1); EP1124724 (B1); DE1238834 (B); EP1775222 (A1); DE3830009 (A1); DE1063519 (B); US5109654 (A); US5109654 (A); DE3830009 (A1); DE1238834 (B); DE1063519 (B); US5109654 (A); EP1124724 (B1); EP1106084 (A2); EP1775222 (A1); WO9812112 (A1); WO2004045951 (A1),,,,,,,,WO2004045951 (A1),,,,,Food packaging,EP2116483 (A1),11/11/2009,DEVENPORT DAVID [GB],BENSON BOX COMPANY LTD [GB],B65D81/34; B65D75/02; B65D85/36,B65D81/343; B65D75/02; B65D2205/02; B65D2585/366,EP20090006339,20090511,GB20080008449 20080509,US3003207 (A); FR2612498 (A1); WO9700040 (A1); US4890549 (A); US2002148882 (A1); US3876131 (A),,,,,,,,,,,,,PREPARATION OF GYROS-BASED PIZZA,GR20070100598 (A),15/05/2009,KALPYRIS STYLIANOS NIKOLAOU,KALPYRIS STYLIANOS NIKOLAOU,A21D13/00,A21D13/007,GR20070100598,20071002,GR20070100598 20071002,,,,,,,,,,,,,,Pizza baker,CN101427697 (A),13/05/2009,YI ZHANG [CN],ZHANG LIN [CN],A21B5/00,,CN20081159874,20081109,CN20081159874 20081109,,,,,,,,,,,,,,STOVE TOP PIZZA OVEN,CA2610236 (A1),13/05/2009,BEDARD MARK [CA],BEDARD MARK [CA],A47J27/00; A47J36/00; A47J37/01,A47J37/01,CA20072610236,20071113,CA20072610236 20071113,,,,,,,,,,,,,,Self-rising dough-containing food product and related manufacturing methods,US2009123607 (A1),14/05/2009,BRODIE JOHN [US];  SHAHEED AMR [US],,A21D10/02; A21D2/08; A21D8/02,A21D17/006; A21D2/02; A21D2/183; A21D2/245; A21D6/001; A21D10/025; A21D13/007; A23V2002/00; A23V2002/00; A23V2250/0616; A23V2200/234; A23V2250/5086,US20050113950,20050425,US20040754867 20040109; US20050113950 20050425,,,,,,,,,,,,,,Multi-functional baking box,CN201223307 (Y),22/04/2009,CHAOHUA LI [CN],CHAOHUA LI [CN],A47J37/06,,CN2008247479U,20080508,CN2008247479U 20080508,,,,,,,,,,,,,,INTELLIGENT USER INTERFACE FOR MULTI-PURPOSE OVEN USING INFRARED HEATING FOR REDUCED COOKING TIME,WO2009058565 (A2); WO2009058565 (A3),07/05/2009,CAVADA LUIS O [US];  VALLEJO-NORIEGA ALVARO [US];  VILBRANDT VICTORIA [US],APPLICA CONSUMER PRODUCTS INC [US];  CAVADA LUIS O [US];  VALLEJO-NORIEGA ALVARO [US];  VILBRANDT VICTORIA [US],,F24C7/08,WO2008US79982,20081015,US20070926333 20071029,,,,,,,,,,,US2005218139 (A1); US2006157470 (A1); US2003121904 (A1); WO9930086 (A1); WO9512962 (A1); US4664923 (A),,,"Shelf forming method for food e.g. pizza dough, cooking oven, involves facing shoulders of lower layer by shoulders of mass slab to intercalate structure between slabs, at level of respective shoulders so as to obtain flat shelf with height",FR2940012 (B1); FR2940012 (A1),25/06/2010,FUGON DIDIER [FR],EPHREM DISTRIB [FR],A21B3/15; F24C15/10,F27D1/0043; F27D1/10,FR20080058935,20081222,FR20080058935 20081222,US2007108177 (A1); US1793129 (A),,,,,,,,,,,,,Method for controlling a cooking program and cooking device,EP2078899 (A3); EP2078899 (A2),15/07/2009,HOEMME REGINA [DE],RATIONAL AG [DE],F24C7/08,F24C7/08; F24C7/082,EP20090150288,20090109,DE20081003853 20080110,EP1384951 (A1); US4914277 (A); DE19718399 (A1); DE4217943 (A1),,,,,,,,DE29923215U (U1); EP0786224 (B1); DE202006001655U (U1); DE102006020883 (A1); DE10120136 (A1); DE10151924 (A1); DE102004008737 (A1); DE29923215U (U1),,,,,No-frying rapid food with frying flavor and appearance,CN101396083 (A),01/04/2009,BO LENG [CN],BO LENG [CN],A23L1/01,,CN20081302317,20080626,CN20072201090U 20070929; CN20081302317 20080626,,,,,,,,,,,,,,"Box i.e. master box, for accommodating pizza, has platform made of corrugated cardboard, comprising flap of three cm in height on each side, where platform is positioned above pizza for accommodating another pizza",FR2935961 (A1); FR2935961 (B1),19/03/2010,VILLEFRANCHE SERGE [FR],VILLEFRANCHE SERGE [FR],B65D5/48,B65D5/48; B65D2585/366,FR20080005029,20080915,FR20080005029 20080915,US6851601 (B1); GB2361912 (A),,,,,,,,,,,,,BREAD MANUFACTURE,KR20090010845 (A),30/01/2009,HYUN NAM SIK [KR],HYUN NAM SIK [KR],A23L1/10; A21D10/00; A21D13/00,,KR20070074317,20070723,KR20070074317 20070723,,,,,,,,,,,,,,ANALOGUE CHEESE AND MANUFACTURING METHOD FOR THE SAME,KR20090006027 (A),14/01/2009,CHON EUN HEE [KR],CHON EUN HEE [KR],A23C19/09; A23C19/00; A23C19/08,,KR20080099221,20081009,KR20080099221 20081009,,,,,,,,,,,,,,PIZZA DOUGH USING SEASONED SURIMI AND PIZZA PREPARED BY THE SAME,KR20090002715 (A),09/01/2009,YOON MYOUNG KEUN [KR];  YOON SHIN DUK [KR],CHAMSAL CO LTD [KR],A21D2/34; A21D13/00; A21D13/04; A23L1/325,,KR20070066886,20070704,KR20070066886 20070704,,,,,,,,,,,,,,Packaging For Pizza,US2009071850 (A1),19/03/2009,FRITZ-JUNG CATHRYN [US];  THOMAS AMANDA B [US];  REBANT JASON E [US];  KAKISH HIBA [US],LITTLE CAESAR ENTPR INC [US],B65D81/26; B65D30/08,B65D77/26; B65D2205/02; B65D2585/366,US20080212197,20080917,US20080212197 20080917; US20070973225P 20070918; US20080021439P 20080116,,,,,,,,,,,,,,Pizza package,CN201198393 (Y),25/02/2009,HANAN ZHENG [CN],HANAN ZHENG [CN],B65D85/36; B65D77/04; B65D81/34,,CN2008266236U,20080327,CN2008266236U 20080327,,,,,,,,,,,,,,Refrigeration type workbench for pizza,CN201197335 (Y),25/02/2009,WEISHUN LU [CN],SHANGHAI FURONG INDUSTRY CO LT [CN],A21C14/00,,CN2008257056U,20080409,CN2008257056U 20080409,,,,,,,,,,,,,,Aromatic Neomenthylamides as flavouring agents,EP2064959 (A1); EP2064959 (B1),03/06/2009,BACKES MICHAEL [DE];  VOESSING TOBIAS [DE];  WOEHRLE INGO [DE],SYMRISE GMBH & CO KG [DE],A23L1/226; C07C233/10; C07C233/11,A23L1/39; A23L1/40; A23L1/22091; A23L1/221; A23L1/22657; A23L1/22671; A23L1/2275; A23L1/24; A23L1/243; C07C233/65; C07C2101/14,EP20080167841,20081029,US20070984023P 20071031,WO2006099762 (A1),XP009113338; XP002519026; XP002519027; XP002519028; XP002519029,,,,,,,US2004202760 (A1); US2004202619 (A1); US2006057268 (A1); US2006068071 (A1); US2005084506 (A1); WO2006099726 (A1); WO2005020897 (A2); WO9926927 (A2); WO2006099762 (A1); EP0242325 (A2); US4518615 (A); US5093136 (A); US5266336 (A); US5601858 (A); US6986709 (B2); US3159585 (A); US3971852 (A); US4532145 (A); US5124162 (A); EP1258200 (A2); WO2006024587 (A1); WO2006106023 (A1); WO2007003527 (A1); WO2006058893 (A2); WO2005096841 (A1); WO2004078302 (A1); WO2007014879 (A1); WO2007107596 (A1); WO2004000787 (A2); WO2004043906 (A2),,,,,Combination delivery box and board game,US2009058003 (A1),05/03/2009,NOUHAN JR HARRY P [US],,A63F3/02; B65D5/00,B65D81/368; A63F3/02; A63F9/001; A63F2003/00943; A63F2009/0012; A63F2250/505,US20070897866,20070904,US20070897866 20070904,,,,,,,,,,,,,,Molded paper pulp pizza box,US2009057381 (A1),05/03/2009,GOKHALE CHANDAN [US],,B65D5/00,B65D43/162; B65D1/26; B65D1/46; B65D43/163; B65D2585/366,US20070897113,20070829,US20070897113 20070829,,,,,,,,,,,,,,PIZZA-BAKING VESSEL AND METHOD FOR BAKING PIZZA USING THE SAME,JP5132214 (B2); JP2009022233 (A),05/02/2009,UENO TAKAO,UIC KK,A21B3/13; A21D13/00,,JP20070190307,20070723,JP20070190307 20070723,JPH0327511U (U); WO2005115208 (A1); JPS5017584U (U); JPH06343379 (A); JP3029345U (U); JP3070975U (U); JPH02503386 (A),,JPH0327511U (U); WO2005115208 (A1); JPS5017584U (U); JPH06343379 (A); JP3029345U (U); JP3070975U (U); JPH02503386 (A),,,,,,,,,,,AUTOMATED CHEESE SHREDDER FOR APPLYING CHEESE TO PIZZA,CA2638688 (A1),17/02/2009,FRITZ-JUNG CATHRYN [US],LITTLE CAESAR ENTPR INC [US],A47J43/25,,CA20082638688,20080814,US20070956508P 20070817; US20080191004 20080813,,,,,,,,,,,,,,High density disk and ellipse for cooking pizza,US2009038483 (A1),12/02/2009,SCORZIELLO DINO [US],,H05B6/12,A47J37/01,US20070890245,20070806,US20070890245 20070806,,,,,,,,,,,,,,"Cooking device i.e. baking-oven, for cooking e.g. pizza, has heating element for heating food in chamber, and main heating zone formed by main heating element and representing ellipse with major axis, which is larger than minor axis",DE102007042087 (A1),12/03/2009,DENGLER KLAUS [DE];  FRANK ROLAND [DE];  HANGL FELIX [DE];  HANGL MARTINA [DE];  SCHLAG RUPERT [DE],BSH BOSCH SIEMENS HAUSGERAETE [DE],F24C7/06; F24C15/00,F24C7/06,DE20071042087,20070905,DE20071042087 20070905,,,,,,,,,,,,,,ELECTRIC PIZZA OVEN,JP4949948 (B2); JP2009005593 (A),15/01/2009,YAMAUCHI MASAO;  SHIBATA HIDEKI;  SHIGETA SUMIKAZU;  SAKAI HIDEKI;  HIROHATA TATSUYA,CHUBU ELECTRIC POWER;  NICHIWA DENKI KK,A21B1/22; A21B1/44; A21B3/00; A21B5/00,,JP20070168291,20070626,JP20070168291 20070626,,,JPH09269127 (A); JP2006296237 (A); JP2007003136 (A); JP2001352893 (A); JPH03123996U (U),,,,,,,,,,,"Interlocking bottom plate i.e. lower box, for delivering e.g. pizza, has lateral walls or tabs including intermediate stop units to stop top plate on bottom plate in partial embedded position of top plate in bottom plate",FR2936226 (A1),26/03/2010,DEPOORTER SOPHIE [FR];  LAMBOTIN PASCAL [FR];  MAHIEUX ERIC [FR];  BOURDIN OLIVIER [FR];  MATHIEU GERARD [FR],OTOR SA [FR],B65D5/00; B65D5/26; B65D21/00,B65D5/0025; B65D5/2033; B65D5/22; B65D2585/366,FR20080005292,20080925,FR20080005292 20080925,DE9209434U (U1); FR2242872 (A5); US3580475 (A); GB1531235 (A); EP0548879 (A1); FR2808506 (A1); FR2808505 (A1),,,,,,,,,,,,,Pizza,USD585178 (S1),27/01/2009,FORTE VITTORIO [IT],,,,US20070283115F,20070807,EM20070669718F 20070212,,,,,,,,,,,,,,Pizza Box with Removable Portions used as Reward Tokens,AU2008255242 (B2); AU2008255242 (A1),15/01/2009,BRAOUDAKIS GEORGE,INITIATIVES AND INNOVATIONS PTY LTD,B65D5/22; B65D5/42; B65D5/46; B65D5/54; B65D5/66; B65D25/20; B65D85/36,B65D5/6661; B65D5/6664; B65D5/6667; B65D25/205; B65D5/22; B65D5/4229; B65D2205/00; B65D2313/04; B65D2585/366; Y10S206/831; Y10S229/915; Y10S229/902,AU20080255242,20081211,AU20030221619 20030417; AU20080255242 20081211; AU2002PS01798 20020417,US6041997 (A); US3949931 (A),,,,,,,,,,,,,Infrared oven,US2009008379 (A1),08/01/2009,INGEMANSON MATS O [US],REDI KWICK CORP [US],F27D11/00,A21B1/22; H05B3/0076,US20080153360,20080516,US20080153360 20080516; US20070930771P 20070518,,,,,,,,,,,,,,